pair_ID,sentence_A,sentence_B,entailment_label,relatedness_score,entailment_AB,entailment_BA,sentence_A_original,sentence_B_original,sentence_A_dataset,sentence_B_dataset,SemEval_set	[sentence_A, sentence_B]
5147,A man is buttering a piece of bread,A man is buttering a slice of bread,ENTAILMENT,4.6,A_entails_B,B_entails_A,a man is buttering a piece of bread,a man is buttering a piece of bread,SEMEVAL,SEMEVAL,TRAIN	[piece, slice]
5210,A man is riding a motorcycle,A man is riding a motorbike,ENTAILMENT,4.8,A_entails_B,B_entails_A,a man is riding a motorcycle,a man is riding a motorcycle,SEMEVAL,SEMEVAL,TEST	[motorcycle, motorbike]
5230,A tiger is walking around,A tiger is strolling around,ENTAILMENT,5,A_entails_B,B_entails_A,a tiger is walking around,a tiger is walking around,SEMEVAL,SEMEVAL,TEST	[walking, strolling]
5266,Somebody is folding a piece of paper,Someone is folding a piece of paper,ENTAILMENT,5,A_entails_B,B_entails_A,someone is folding a piece of paper,someone is folding a piece of paper,SEMEVAL,SEMEVAL,TEST	[Somebody, Someone]
5268,Somebody is folding a piece of paper,A person is folding a piece of paper,ENTAILMENT,4.7,A_entails_B,B_entails_A,a person is folding a piece of paper,someone is folding a piece of paper,SEMEVAL,SEMEVAL,TEST	[Somebody, person]
5272,A person is folding a piece of paper,Someone is folding a piece of paper,ENTAILMENT,4.8,A_entails_B,B_entails_A,a person is folding a piece of paper,someone is folding a piece of paper,SEMEVAL,SEMEVAL,TEST	[person, Someone]
5282,A rabbit is playing with a stuffed bunny,A bunny is playing with a stuffed bunny,ENTAILMENT,4.5,A_entails_B,B_entails_A,a bunny is playing with a stuffed bunny,a bunny is playing with a stuffed bunny,SEMEVAL,SEMEVAL,TRAIN	[rabbit]
5327,A man is jumping into a pool,A man is diving into a pool,ENTAILMENT,4.8,A_entails_B,B_entails_A,a man dives into a pool,a man dives into a pool,SEMEVAL,SEMEVAL,TRAIN	[jumping, diving]
5362,The lady is peeling the potato,A woman is peeling a potato,ENTAILMENT,5,A_entails_B,B_entails_A,a woman is peeling a potato,the lady peeled the potatoe,SEMEVAL,SEMEVAL,TRAIN	[lady, woman]
5390,A man is putting some food in a box,A man is putting some food in a container,ENTAILMENT,4.4,A_entails_B,B_entails_A,a man is putting foods in a box,a man is putting foods in a box,SEMEVAL,SEMEVAL,TEST	[box, container]
5432,Someone is reading the email,A person is reading the email,ENTAILMENT,4.8,A_entails_B,B_entails_A,someone is reading an email,a man is reading his email,SEMEVAL,SEMEVAL,TRAIN	[Someone, person]
5458,A man is playing a flute,A man is playing the flute,ENTAILMENT,4.9,A_entails_B,B_entails_A,a man is playing a flute,a woman is playing the flute,SEMEVAL,SEMEVAL,TRAIN	[]
5489,A man is cutting tomatoes,A man is slicing tomatoes,ENTAILMENT,5,A_entails_B,B_entails_A,a man is cutting tomatoes,a man is cutting tomatoes,SEMEVAL,SEMEVAL,TRAIN	[cutting, slicing]
5525,A woman is cutting onions,A woman is chopping onions,ENTAILMENT,4.5,A_entails_B,B_entails_A,a woman is cutting onions,a woman is cutting onions,SEMEVAL,SEMEVAL,TRAIN	[cutting, chopping]
5527,A woman is slicing tofu,A woman is cutting tofu,ENTAILMENT,4.8,A_entails_B,B_entails_A,a woman is cutting tofu,a woman is cutting tofu,SEMEVAL,SEMEVAL,TEST	[slicing, cutting]
5570,A man is breaking a slab of concrete with a sledge hammer,A man is breaking a block of concrete with a sledge hammer,ENTAILMENT,4.7,A_entails_B,B_entails_A,a man breaks a slab of concrete that is lying on a prone man with a sledge hammer,a man breaks a slab of concrete that is lying on a prone man with a sledge hammer,SEMEVAL,SEMEVAL,TEST	[slab, block]
5597,A man is talking,A man is speaking,ENTAILMENT,4.9,A_entails_B,B_entails_A,a man is speaking,a man is speaking,SEMEVAL,SEMEVAL,TEST	[talking, speaking]
5615,A man is cutting a boot with a sword,A man is cutting a boot with a blade,ENTAILMENT,4.7,A_entails_B,B_entails_A,a man is cutting a boot with a sword,a man is cutting a boot with a sword,SEMEVAL,SEMEVAL,TRAIN	[sword, blade]
5617,A person is severing the toe of an empty leather boot with a sword,A man is severing the toe of an empty leather boot with a sword,ENTAILMENT,4.815,A_entails_B,B_entails_A,a man severs the toe of an empty leather boot using a sword,a man severs the toe of an empty leather boot using a sword,SEMEVAL,SEMEVAL,TRAIN	[person, man]
5626,A man is wiping the edge of a bowl,A man is cleaning the edge of a bowl,ENTAILMENT,4.9,A_entails_B,B_entails_A,a man is wiping the edge of a bowl off,a man is wiping the edge of a bowl off,SEMEVAL,SEMEVAL,TEST	[wiping, cleaning]
5669,A small dog is lying on the bed,A small dog is lying on a bed,ENTAILMENT,5,A_entails_B,B_entails_A,a small dog is laying on a bed,a small dog is laying on a bed,SEMEVAL,SEMEVAL,TEST	[]
5677,A small dog is lying on a bed,A small dog is lying on the bed,ENTAILMENT,5,A_entails_B,B_entails_A,a small dog is laying on a bed,a small dog laying on the bed,SEMEVAL,SEMEVAL,TRAIN	[]
5678,A woman is cutting butter,A woman is slicing butter,ENTAILMENT,4.7,A_entails_B,B_entails_A,a woman is slicing butter,a woman is slicing butter,SEMEVAL,SEMEVAL,TRAIN	[cutting, slicing]
5713,A man is shooting a shotgun,A man is firing a shotgun,ENTAILMENT,4.9,A_entails_B,B_entails_A,a man is firing a shot gun,a man shoots a shotgun,SEMEVAL,SEMEVAL,TEST	[shooting, firing]
5743,A tiger cub is playing with a ball,A baby tiger is playing with a ball,ENTAILMENT,4.9,A_entails_B,B_entails_A,a baby tiger is playing with a ball,a baby tiger is playing with a ball,SEMEVAL,SEMEVAL,TEST	[cub, baby]
5750,The man is playing a game on a lawn,The man is playing a game on the grass,ENTAILMENT,4.2,A_entails_B,B_entails_A,the men played follow the leader on the grass,the men played follow the leader on the grass,SEMEVAL,SEMEVAL,TRAIN	[lawn, grass]
5762,A woman is cracking eggs,A woman is breaking eggs,ENTAILMENT,4.8,A_entails_B,B_entails_A,a woman is cracking eggs,a woman is cracking eggs,SEMEVAL,SEMEVAL,TRAIN	[cracking, breaking]
5779,A cat is jumping into a container,A cat is jumping into a box,ENTAILMENT,4.4,A_entails_B,B_entails_A,a cat is jumping into a box,a cat is jumping into a box,SEMEVAL,SEMEVAL,TRAIN	[container, box]
5796,A man is slicing a fish,A man is cutting a fish,ENTAILMENT,4.7,A_entails_B,B_entails_A,a man is cutting up a fish,a man is slicing open a fish,SEMEVAL,SEMEVAL,TEST	[slicing, cutting]
5815,A woman is cutting a tomato,A woman is slicing a tomato,ENTAILMENT,4.8,A_entails_B,B_entails_A,a woman is cutting a tomatoe,a woman is cutting a tomatoe,SEMEVAL,SEMEVAL,TRAIN	[cutting, slicing]
5842,The man is playing the guitar,The man is playing the instrument,ENTAILMENT,4.4,A_entails_B,B_entails_A,the man is playing the guitar,the man is playing the guitar,SEMEVAL,SEMEVAL,TRAIN	[guitar, instrument]
5875,An animal is biting a person's finger,An animal is biting someone's finger,ENTAILMENT,5,A_entails_B,B_entails_A,an animal is biting a persons finger,a slow loris is biting a persons finger,SEMEVAL,SEMEVAL,TRAIN	[person's, someone's]
5889,The girl is tapping her fingernails,A girl is tapping her fingernails,ENTAILMENT,4.9,A_entails_B,B_entails_A,a girl is tapping her finger nails,a girl is tapping her finger nails,SEMEVAL,SEMEVAL,TEST	[]
5941,The man is standing on a rocky mountain and gray clouds are in the background,The man is standing on a mountain which is rocky and gray clouds are in the background,ENTAILMENT,4.7,A_entails_B,B_entails_A,a man standing on a rocky mountain with gray clouds in the background,a man standing on a rocky mountain with gray clouds in the background,FLICKR,FLICKR,TRAIN	[which]
5943,A person with a back pack who is topless is in front of a pile of rocks and clouds are in the background,A topless person with a back pack is in front of a pile of rocks and clouds are in the background,ENTAILMENT,5,A_entails_B,B_entails_A,a topless person with a back pack is shown against on a pile of rocks with a cloudy background,a topless person with a back pack is shown against on a pile of rocks with a cloudy background,FLICKR,FLICKR,TRAIN	[who]
5952,The dog is catching a ball,A dog is catching a ball,ENTAILMENT,5,A_entails_B,B_entails_A,a dog is running towards a ball to catch it,a dog is running towards a ball to catch it,FLICKR,FLICKR,TRAIN	[]
5961,A boy in a blue shirt has dirt on his face,A boy in a blue dyed shirt has dirt on his face,ENTAILMENT,4.7,A_entails_B,B_entails_A,a boy in a blue shirt with dirt on his face,a boy in a blue shirt with dirt on his face,FLICKR,FLICKR,TEST	[dyed]
5983,A large white crane is flying near the water,A crane which is large and white is flying near the water,ENTAILMENT,4.9,A_entails_B,B_entails_A,large white crane is flying low near the water,large white crane is flying low near the water,FLICKR,FLICKR,TRAIN	[which, and]
5985,A white bird is landing swiftly in the water,The white bird is landing swiftly in the water,ENTAILMENT,4.9,A_entails_B,B_entails_A,a white birds lands swiftly in the water,a white birds lands swiftly in the water,FLICKR,FLICKR,TEST	[]
5996,A dog with golden fur is in the water,A dog with a golden coat is in the water,ENTAILMENT,4.9,A_entails_B,B_entails_A,a dog with golden fur is chest deep in water,a dog with golden fur is chest deep in water,FLICKR,FLICKR,TRAIN	[fur, coat]
6003,A girl in a blue shirt who looks young is walking on the sidewalk and holding up a pink sign,A young girl in a blue shirt is walking on the sidewalk and holding up a pink sign,ENTAILMENT,4.9,A_entails_B,B_entails_A,a young girl in a blue shirt is walking in the sidewalk and holding up a pink sign that says the rescue.,a young girl in a blue shirt is walking in the sidewalk and holding up a pink sign that says the rescue.,FLICKR,FLICKR,TEST	[who, looks]
6014,One man in a big city is holding up a sign and begging for money,A man in a big city is holding a sign and begging for money,ENTAILMENT,5,A_entails_B,B_entails_A,a man in seattle holds a sign begging for money,a man in seattle holds a sign begging for money,FLICKR,FLICKR,TRAIN	[One, up]
6017,A homeless man is holding up a sign and is begging for money,A homeless man is holding up a sign and is pitifully begging for money,ENTAILMENT,4.9,A_entails_B,B_entails_A,a homeless man holds up a sign begging for money for beer pot and a hooker,a homeless man holds up a sign begging for money for beer pot and a hooker,FLICKR,FLICKR,TRAIN	[pitifully]
6025,A small dog is chasing a large brown cow,A dog which is small is chasing a large brown cow,ENTAILMENT,5,A_entails_B,B_entails_A,a small dog chases after a large brown cow,a small dog chases after a large brown cow,FLICKR,FLICKR,TEST	[which]
6027,A dog is chasing the tail of an animal in the grass,The tail of an animal is being chasing by a dog in the grass,ENTAILMENT,4.9,A_entails_B,B_entails_A,a dog chasing an animals tail on the grass,a dog chasing an animals tail on the grass,FLICKR,FLICKR,TRAIN	[being, by]
6034,The small child is walking through the water and is being guided by another person,The small child is wading through the water and is being guided by another person,ENTAILMENT,4.6,A_entails_B,B_entails_A,a small child wades through the water while being guided by another person,a small child wades through the water while being guided by another person,FLICKR,FLICKR,TEST	[walking, wading]
6036,A young child is splashing in the water,The young child is splashing in the water,ENTAILMENT,4.9,A_entails_B,B_entails_A,a young child splashing in water,a young child splashing in water,FLICKR,FLICKR,TEST	[]
6047,A man and a woman are in a room painted beige wearing dark colored shirts and a monitor is in the background,A man and a woman are in a beige room wearing dark colored shirts and a monitor is in the background,ENTAILMENT,5,A_entails_B,B_entails_A,a man and a woman wear dark colored shirts in a beige room with a moniter in the background,a man and a woman wear dark colored shirts in a beige room with a moniter in the background,FLICKR,FLICKR,TRIAL	[painted]
6065,A person in a blue jacket is jumping off of a tall cement wall,A person in a blue colored jacket is jumping off of a tall cement wall,ENTAILMENT,4.9,A_entails_B,B_entails_A,a person in a blue jacket jumps off of a tan cement wall,a person in a blue jacket jumps off of a tan cement wall,FLICKR,FLICKR,TRAIN	[colored]
6074,A woman in jeans is sitting on the saddle of a horse,The woman in jeans is sitting on the saddle of a horse,ENTAILMENT,4.9,A_entails_B,B_entails_A,a woman in jeans is sitting on the saddle of a horse,a woman in jeans is sitting on the saddle of a horse,FLICKR,FLICKR,TEST	[]
6083,The brown dog and the red dog are frolicking on the beach,A brown dog and a red dog are frolicking on the beach,ENTAILMENT,4.9,A_entails_B,B_entails_A,a brown dog and a red dog frolicking on the waters edge on the beach,a brown dog and a red dog frolicking on the waters edge on the beach,FLICKR,FLICKR,TRAIN	[]
6085,The brown dogs are playfully fighting on the sandy beach,The brown dogs are playfully fighting on the sandy shore,ENTAILMENT,4.8,A_entails_B,B_entails_A,two brown dogs chase and playfully fight with each other on the sandy beach,two brown dogs chase and playfully fight with each other on the sandy beach,FLICKR,FLICKR,TRAIN	[beach, shore]
6094,A man is standing beside a birdcage which is large and colorful,A man is standing beside a large and colorful birdcage,ENTAILMENT,4.8,A_entails_B,B_entails_A,a man is standing beside a large colorful birdcage containing birds,a man is standing beside a large colorful birdcage containing birds,FLICKR,FLICKR,TEST	[which]
6101,One brown and black dog is running through the leaves,A brown and black dog is running through the leaves,ENTAILMENT,4.8,A_entails_B,B_entails_A,a brown and black dog runs through the leaves,a brown and black dog runs through the leaves,FLICKR,FLICKR,TRAIN	[One]
6135,A group of racing dogs is wearing striped uniforms and is running down a track,A group of dogs bred for racing is wearing striped uniforms and is running down a track,ENTAILMENT,4.7,A_entails_B,B_entails_A,a group of racing dogs wearing striped uniforms with numbers run down a track,a group of racing dogs wearing striped uniforms with numbers run down a track,FLICKR,FLICKR,TRAIN	[bred, for]
6154,The person in the blue jacket is wearing a colorful helmet,A person in a blue jacket is wearing a colorful helmet,ENTAILMENT,5,A_entails_B,B_entails_A,the person in the blue jacket has a colorful helmet on,the person in the blue jacket has a colorful helmet on,FLICKR,FLICKR,TRAIN	[]
6170,A woman in a yellow dyed shirt is surfing on a pink surfboard,A woman in a yellow shirt is surfing on a pink surfboard,ENTAILMENT,4.6,A_entails_B,B_entails_A,a woman in a yellow shirt surfs on a pink surfboard,a woman in a yellow shirt surfs on a pink surfboard,FLICKR,FLICKR,TRAIN	[dyed]
6185,The group of people is sitting on a ledge which is rocky and a scenic view is behind them,The group of people is sitting on a rocky ledge and a scenic view is behind them,ENTAILMENT,5,A_entails_B,B_entails_A,a group of people sit on a rocky ledge with a scenic view behind them,a group of people sit on a rocky ledge with a scenic view behind them,FLICKR,FLICKR,TRAIN	[which]
6194,A group of Asian girls are standing together,The group of Asian girls are standing together,ENTAILMENT,4.9,A_entails_B,B_entails_A,a group of asian girls are standing together,a group of asian girls are standing together,FLICKR,FLICKR,TRAIN	[]
6223,The crowd is watching two cars designed for racing that are leaving the starting line,The crowd is watching two racing cars that are leaving the starting line,ENTAILMENT,4.7,A_entails_B,B_entails_A,a crowd watches as two formula one cars leave the starting line,a crowd watches as two formula one cars leave the starting line,FLICKR,FLICKR,TEST	[designed, for]
6239,A dog which is brown is jumping in the air,A brown dog is jumping in the air,ENTAILMENT,4.9,A_entails_B,B_entails_A,a brown dog jumps in the air,a brown dog jumps in the air,FLICKR,FLICKR,TRAIN	[which]
6241,A malnourished looking dog is standing on its hind legs and preparing to jump,The malnourished looking dog is standing on its hind legs and is preparing to jump,ENTAILMENT,5,A_entails_B,B_entails_A,a dog appearing to be malnourished is standing on his hind legs about to jump,a dog appearing to be malnourished is standing on his hind legs about to jump,FLICKR,FLICKR,TRAIN	[]
6248,The cop is sitting on a police bike,The cop is sitting on a police bicycle,ENTAILMENT,4.8,A_entails_B,B_entails_A,a cop sitting on his police bike,a cop sitting on his police bike,FLICKR,FLICKR,TRAIN	[bike, bicycle]
6259,Two women are wearing bikinis on the sandy beach,Two women are wearing bikinis on the beach which is sandy,ENTAILMENT,4.9,A_entails_B,B_entails_A,two women wearing bikinis on a sandy beach,two women wearing bikinis on a sandy beach,FLICKR,FLICKR,TRAIN	[which, is]
6261,Two women are wearing bikinis and walking on the sand,Two women are wearing bikinis and are walking on the sand,ENTAILMENT,5,A_entails_B,B_entails_A,two women wearing bikinis are walking on the sand,two women wearing bikinis are walking on the sand,FLICKR,FLICKR,TEST	[]
6268,A dog is swimming in a lake and the sun is shining on him,The dog is swimming in a lake and the sun is shining on him,ENTAILMENT,4.9,A_entails_B,B_entails_A,a dog swimming in a lake has sunshine shining on him,a dog swimming in a lake has sunshine shining on him,FLICKR,FLICKR,TEST	[]
6279,A black dog is running in the grass and its tongue is hanging out,A black dog is hanging out in the grass and running with its tongue out,ENTAILMENT,4.6,A_entails_B,B_entails_A,a black dog runs in the grass its tongue hanging out,a black dog runs in the grass its tongue hanging out,FLICKR,FLICKR,TEST	[with]
6280,A dog which is black is running in the grass,A black dog is running in the grass,ENTAILMENT,5,A_entails_B,B_entails_A,a black dog running in grass,a black dog running in grass,FLICKR,FLICKR,TRIAL	[which]
6288,The cheerleaders are parading and wearing uniforms which are black pink and white,The cheerleaders are parading and wearing black pink and white uniforms,ENTAILMENT,4.8,A_entails_B,B_entails_A,parade of cheerleaders wearing black pink and white uniforms,parade of cheerleaders wearing black pink and white uniforms,FLICKR,FLICKR,TRAIN	[which]
6297,The man is sitting outside under a purple umbrella,The man is sitting outdoors under a purple umbrella,ENTAILMENT,5,A_entails_B,B_entails_A,the man is sitting outside on the street under a purple umbrella,the man is sitting outside on the street under a purple umbrella,FLICKR,FLICKR,TRAIN	[outside, outdoors]
6299,A shoeless woman is sitting on a blanket under a lavender umbrella,A woman who is shoeless is sitting on a blanket under a lavender umbrella,ENTAILMENT,4.8,A_entails_B,B_entails_A,a gray-haired shoeless woman is sitting on a blanket under a lavendar umbrella on the side of a street,a gray-haired shoeless woman is sitting on a blanket under a lavendar umbrella on the side of a street,FLICKR,FLICKR,TRAIN	[who]
6306,The woman is playing with two young boys at a park,A woman is playing with two young boys at a park,ENTAILMENT,5,A_entails_B,B_entails_A,a woman playing with two young boys at a park,a woman playing with two young boys at a park,FLICKR,FLICKR,TRAIN	[]
6308,A lady is standing near three children,A woman is standing near three children,ENTAILMENT,4.9,A_entails_B,B_entails_A,a woman and three children,a woman and three children,FLICKR,FLICKR,TRAIN	[lady, woman]
6317,A tan dog is running through the snow,A dog which is tan is running through the snow,ENTAILMENT,4.9,A_entails_B,B_entails_A,a tan dog runs through the snow,a tan dog runs through the snow,FLICKR,FLICKR,TRAIN	[which]
6327,The little girl in a pink shirt is running under a tree in the desert,A little girl in a pink shirt is running under a tree in the desert,ENTAILMENT,4.9,A_entails_B,B_entails_A,the little girl in the pink shirt is running under a tree in the desert,the little girl in the pink shirt is running under a tree in the desert,FLICKR,FLICKR,TRAIN	[]
6346,A child who is young is riding a bike on a rough dirt path,A young child is riding a bike on a rough dirt path,ENTAILMENT,4.9,A_entails_B,B_entails_A,a young child rides a bike on a rough dirt path,a young child rides a bike on a rough dirt path,FLICKR,FLICKR,TRAIN	[who]
6348,The young boy is riding a dirt bike through the mud,A young boy is riding a dirt bike through the mud,ENTAILMENT,4.9,A_entails_B,B_entails_A,a young boy riding a dirt bike through the mud,a young boy riding a dirt bike through the mud,FLICKR,FLICKR,TRAIN	[]
6366,A young child is wearing a white coat and playing a game,A child who is young is wearing a white coat and playing a game,ENTAILMENT,4.9,A_entails_B,B_entails_A,a young child wearing a white coat playing a children's gold game,a young child wearing a white coat playing a children's gold game,FLICKR,FLICKR,TRAIN	[who]
6377,A surfer is leaning on a surfboard,The surfer is leaning on a surfboard,ENTAILMENT,5,A_entails_B,B_entails_A,surfer leaning back on surfboard,surfer leaning back on surfboard,FLICKR,FLICKR,TRAIN	[]
6388,The people are walking on the road beside a beautiful waterfall,The people are walking on the road beside a waterfall which is beautiful,ENTAILMENT,4.9,A_entails_B,B_entails_A,a beautiful water fall with two people walking on the road beside it,a beautiful water fall with two people walking on the road beside it,FLICKR,FLICKR,TEST	[which, is]
6395,A dog is herding a group of white sheep on a dusty farm,A dog is herding a pack of white sheep on a dusty farm,ENTAILMENT,5,A_entails_B,B_entails_A,a wolf-like dog herds a pack of white sheep on a dusty farm,a wolf-like dog herds a pack of white sheep on a dusty farm,FLICKR,FLICKR,TRAIN	[group, pack]
6397,A sheepdog is grouping a herd of sheep,The sheepdog is grouping a herd of sheep,ENTAILMENT,5,A_entails_B,B_entails_A,a sheepdog is rounding up a herd of sheep,a sheepdog is rounding up a herd of sheep,FLICKR,FLICKR,TRAIN	[]
6404,The male who is dark skinned is standing on one hand in front of a yellow building,The dark skinned male is standing on one hand in front of a yellow building,ENTAILMENT,5,A_entails_B,B_entails_A,a darked skinned male is standing on one palm in front of a yellow building,a darked skinned male is standing on one palm in front of a yellow building,FLICKR,FLICKR,TRAIN	[who]
6426,A man in a purple suit is standing by a purple case and is playing a guitar,A man in a purple colored suit is standing by a purple case and is playing a guitar,ENTAILMENT,4.9,A_entails_B,B_entails_A,a man in a purple suit is standing by a purple case playing a guitar,a man in a purple suit is standing by a purple case playing a guitar,FLICKR,FLICKR,TRAIN	[colored]
6437,Two adults are sitting in the chairs and are watching the ocean,Some adults are sitting in the chairs and are watching the ocean,ENTAILMENT,4.7,A_entails_B,B_entails_A,two adults sitting in chairs overlooking the ocean,two adults sitting in chairs overlooking the ocean,FLICKR,FLICKR,TEST	[Two, Some]
6439,A couple is sitting on a patio and is staring at the ocean,A couple is sitting on a patio and looking at the ocean,ENTAILMENT,4.7,A_entails_B,B_entails_A,a couple sit on a patio overlooking the ocean,a couple sit on a patio overlooking the ocean,FLICKR,FLICKR,TEST	[staring, looking]
6446,A small boy in a shirt which is yellow is laughing on the beach,A small boy in a yellow shirt is laughing on the beach,ENTAILMENT,5,A_entails_B,B_entails_A,a small boy in a yellow shirt laughing on the beach,a small boy in a yellow shirt laughing on the beach,FLICKR,FLICKR,TEST	[which]
6448,The little boy is wearing a yellow tank top and is laughing,A little boy is wearing a yellow tank top and is laughing,ENTAILMENT,5,A_entails_B,B_entails_A,a little boy wearing a yellow tank top is laughing,a little boy wearing a yellow tank top is laughing,FLICKR,FLICKR,TRAIN	[]
6457,The orange rescue boat is rushing across the water,The rescue boat which is orange is rushing across the water,ENTAILMENT,5,A_entails_B,B_entails_A,the orange rescue boat rushes across the water,the orange rescue boat rushes across the water,FLICKR,FLICKR,TEST	[which]
6477,A person is standing in a vast field of glacial ice,One person is standing in a vast field of glacial ice,ENTAILMENT,4.8,A_entails_B,B_entails_A,a person stands in a vast field of glacial ice,a person stands in a vast field of glacial ice,FLICKR,FLICKR,TRAIN	[One]
6486,A blond boy is sliding down a dune of sand on a skateboard,A blond boy is sliding down a sand dune on a skateboard,ENTAILMENT,4.9,A_entails_B,B_entails_A,a blond boy slides down a sand dune on a skateboard with no wheels,a blond boy slides down a sand dune on a skateboard with no wheels,FLICKR,FLICKR,TEST	[of]
6488,A woman is swiftly snowboarding down an incline and another woman is standing behind her,A woman is snowboarding down an incline and another woman is standing behind her,ENTAILMENT,4.9,A_entails_B,B_entails_A,a woman is snowboarding down an incline while another woman stands behind,a woman is snowboarding down an incline while another woman stands behind,FLICKR,FLICKR,TRAIN	[swiftly]
6506,A little black dog is chasing a little brown dog,A dog which is little and black is chasing a little brown dog,ENTAILMENT,4.8,A_entails_B,B_entails_A,a little black dog chasing a little brown one,a little black dog chasing a little brown one,FLICKR,FLICKR,TRAIN	[which, and]
6508,The brown dog and the black dog are in the grass,A brown dog and a black dog are in the grass,ENTAILMENT,4.9,A_entails_B,B_entails_A,one brown and one black dog in grass,one brown and one black dog in grass,FLICKR,FLICKR,TRAIN	[]
