pair_ID,sentence_A,sentence_B,entailment_label,relatedness_score,entailment_AB,entailment_BA,sentence_A_original,sentence_B_original,sentence_A_dataset,sentence_B_dataset,SemEval_set	[sentence_A, sentence_B]
6546,A child who looks young is standing in front of some trees,A young child is standing in front of some trees,ENTAILMENT,4.9,A_entails_B,B_entails_A,a young child is standing in front of some trees,a young child is standing in front of some trees,FLICKR,FLICKR,TRAIN	[who, looks]
6548,The small boy is standing in the forest,A small boy is standing in the forest,ENTAILMENT,5,A_entails_B,B_entails_A,small boy in forest,small boy in forest,FLICKR,FLICKR,TRAIN	[]
6555,Two people are looking at a statue made of gold,Two people are looking at a gold statue,ENTAILMENT,4.5,A_entails_B,B_entails_A,two people look up towards a gold statue,two people look up towards a gold statue,FLICKR,FLICKR,TRAIN	[made, of]
6566,The woman is wearing a blue helmet and is riding a bicycle in a parking lot,A woman is wearing a blue helmet and is riding a bicycle in a parking lot,ENTAILMENT,5,A_entails_B,B_entails_A,a woman wearing a blue helmet rides her bicycle in a parking lot,a woman wearing a blue helmet rides her bicycle in a parking lot,FLICKR,FLICKR,TRAIN	[]
6575,A pet dog is standing on the bank and is looking at another dog which is brown in the pond,A pet dog is standing on the bank and is looking at another brown dog in the pond,ENTAILMENT,4.7,A_entails_B,B_entails_A,a pet dog standing on bank is looking at another brown dog inside a pond,a pet dog standing on bank is looking at another brown dog inside a pond,FLICKR,FLICKR,TRAIN	[which]
6584,A young female is dancing,A young girl is dancing,ENTAILMENT,4.7,A_entails_B,B_entails_A,a young girl dancing,a young girl dancing,FLICKR,FLICKR,TRAIN	[female, girl]
6595,The small bee is landing on a bunch of yellow flowers,A small bee is landing on a bunch of yellow flowers,ENTAILMENT,4.9,A_entails_B,B_entails_A,a small bee landed on a bunch of yellow flowers,a small bee landed on a bunch of yellow flowers,FLICKR,FLICKR,TRAIN	[]
6620,A tan dog is running through the brush,A dog which is tan is running through the brush,ENTAILMENT,5,A_entails_B,B_entails_A,a tan dog runs through the brush,a tan dog runs through the brush,FLICKR,FLICKR,TRAIN	[which]
6622,A white dog with beige spots is running through a field,A white dog with beige spots is speeding through a field,ENTAILMENT,4.7,A_entails_B,B_entails_A,a white dog with beige spots is running through a field,a white dog with beige spots is running through a field,FLICKR,FLICKR,TEST	[running, speeding]
6662,Two women with folded arms who are young are looking at the screen,Two young women with folded arms are looking at the screen,ENTAILMENT,5,A_entails_B,B_entails_A,two young women one with folded arms look off screen,two young women one with folded arms look off screen,FLICKR,FLICKR,TEST	[who]
6671,A classroom full of students is looking in the same direction inside a bamboo structure,A classroom full of students is looking attentively in the same direction inside a bamboo structure,ENTAILMENT,4.8,A_entails_B,B_entails_A,a classroom full of students is looking in the same direction inside a bamboo structure,a classroom full of students is looking in the same direction inside a bamboo structure,FLICKR,FLICKR,TRAIN	[attentively]
6680,Three boys are jumping off a platform,Some boys are jumping off a platform,ENTAILMENT,4.8,A_entails_B,B_entails_A,three boys jumping off of a platform,three boys jumping off of a platform,FLICKR,FLICKR,TEST	[Three, Some]
6687,A group of kids is playing on a structure which is colorful,A group of kids is playing on a colorful structure,ENTAILMENT,5,A_entails_B,B_entails_A,a group of kids play on a colorful structure,a group of kids play on a colorful structure,FLICKR,FLICKR,TRAIN	[which]
6707,A little child in a pink sweater is climbing a concrete staircase,A small child in a pink sweater is climbing a concrete staircase,ENTAILMENT,4.8,A_entails_B,B_entails_A,a small child in a pink sweater begins to climb a concrete staircase,a small child in a pink sweater begins to climb a concrete staircase,FLICKR,FLICKR,TEST	[little, small]
6716,A bird which is black is sitting on a dead tree,A black bird is sitting on a dead tree,ENTAILMENT,5,A_entails_B,B_entails_A,a black bird sits in a dead tree,a black bird sits in a dead tree,FLICKR,FLICKR,TEST	[which]
6756,A large brown dog and a small grey dog are standing on a rocky surface,A big brown dog and a small grey dog are standing on a rocky surface,ENTAILMENT,4.8,A_entails_B,B_entails_A,a large brown dog and a small grey dog on a rocky surface with weeds behind them,a large brown dog and a small grey dog on a rocky surface with weeds behind them,FLICKR,FLICKR,TRIAL	[large, big]
6774,A dog is jumping for a Frisbee in the snow,The dog is jumping for a Frisbee in the snow,ENTAILMENT,5,A_entails_B,B_entails_A,a dog jumping for a frisbee in the snow,a dog jumping for a frisbee in the snow,FLICKR,FLICKR,TEST	[]
6776,A black dog in the snow is jumping off the ground and catching a stick,A black dog in the snow is leaping off the ground and catching a stick,ENTAILMENT,5,A_entails_B,B_entails_A,a black dog in snow is jumping off the ground to catch a stick,a black dog in snow is jumping off the ground to catch a stick,FLICKR,FLICKR,TEST	[jumping, leaping]
6792,Two children are peering over a ledge which is rusty,Two children are peering over a rusty ledge,ENTAILMENT,4.9,A_entails_B,B_entails_A,two children peer over a rusty ledge,two children peer over a rusty ledge,FLICKR,FLICKR,TEST	[which, is]
6794,Two children are crouching under some bars made of metal,Two children are crouching under some metal bars,ENTAILMENT,5,A_entails_B,B_entails_A,two children trying to squeeze under some metal bars,two children trying to squeeze under some metal bars,FLICKR,FLICKR,TEST	[made, of]
6801,The player in purple white and black is playing near the end of the field,A player in purple white and black is playing near the end of the field,ENTAILMENT,5,A_entails_B,B_entails_A,a player in purple white and black attempts to make a play near the end of a field,a player in purple white and black attempts to make a play near the end of a field,FLICKR,FLICKR,TEST	[]
6814,One person is riding a bicycle in the sand beside the ocean,A person is riding a bicycle in the sand beside the ocean,ENTAILMENT,4.7,A_entails_B,B_entails_A,a person rides his bicycle in the sand beside the ocean,a person rides his bicycle in the sand beside the ocean,FLICKR,FLICKR,TRAIN	[One]
6821,A large duck is flying over a rocky stream,A duck which is large is flying over a rocky stream,ENTAILMENT,4.8,A_entails_B,B_entails_A,a large duck in flight over a rocky stream,a large duck in flight over a rocky stream,FLICKR,FLICKR,TEST	[which]
6832,The kids are chasing each other in the sand,The children are chasing each other in the sand,ENTAILMENT,4.9,A_entails_B,B_entails_A,two kids chasing each other in the sand,two kids chasing each other in the sand,FLICKR,FLICKR,TEST	[kids, children]
6834,A little boy is running on the ground and playing with a little girl,The little boy is running on the ground and playing with a little girl,ENTAILMENT,4.8,A_entails_B,B_entails_A,a little boy is running on the round playing with a little girl,a little boy is running on the round playing with a little girl,FLICKR,FLICKR,TRAIN	[]
6841,Two small children are playing with a toy car in the street,Two children who are small are playing with a toy car in the street,ENTAILMENT,4.9,A_entails_B,B_entails_A,two small children play with a toy riding car in the street with a grown up,two small children play with a toy riding car in the street with a grown up,FLICKR,FLICKR,TEST	[who]
6861,A golden dog is running through a field of tall grass,The golden dog is running through a field of tall grass,ENTAILMENT,4.9,A_entails_B,B_entails_A,a golden dog runs through a field of tall grass,a golden dog runs through a field of tall grass,FLICKR,FLICKR,TEST	[]
6863,A brown dog is running through the grass which is tall and green,A brown dog is running through tall green grass,ENTAILMENT,5,A_entails_B,B_entails_A,a brown dog is running through tall green grass,a brown dog is running through tall green grass,FLICKR,FLICKR,TRAIN	[which, and]
6879,The large brown dog is running outdoors in the dirt,The large brown dog is running outside in the dirt,ENTAILMENT,4.9,A_entails_B,B_entails_A,the large brown dog is running outside in the dirt,the large brown dog is running outside in the dirt,FLICKR,FLICKR,TRAIN	[outdoors, outside]
6881,A dog is running alongside a fence on a dirt track,A dog is running alongside a fence on a track full of dirt,ENTAILMENT,4.9,A_entails_B,B_entails_A,a dog running along a fence on a dirt track,a dog running along a fence on a dirt track,FLICKR,FLICKR,TEST	[full, of]
6888,A young girl in a coat made for winter is jumping off a boulder into the sand at a beach,A young girl in a winter coat is jumping off a boulder into the sand at a beach,ENTAILMENT,4.8,A_entails_B,B_entails_A,young girl in winter coat jumping off a boulder into the sand at a beach,young girl in winter coat jumping off a boulder into the sand at a beach,FLICKR,FLICKR,TEST	[made, for]
6890,A girl is jumping off a rock and another is standing on it,One girl is jumping off a rock and another is standing on it,ENTAILMENT,4.8,A_entails_B,B_entails_A,a girl jumps off a rock while another stands on it,a girl jumps off a rock while another stands on it,FLICKR,FLICKR,TRAIN	[One]
6899,A young man with brown hair and shades is sitting in front of some cans of soda,A young man with brown hair and sunglasses is sitting in front of some cans of soda,ENTAILMENT,5,A_entails_B,B_entails_A,a young man with brown hair and sunglasses sits by cans of soda,a young man with brown hair and sunglasses sits by cans of soda,FLICKR,FLICKR,TRAIN	[shades, sunglasses]
6906,A woman wearing a blue and white uniform with a white and blue hat is keeping her mouth open and is near others dressed in the same fashion,The woman wearing the blue and white uniform with a white and blue hat is keeping her mouth open and is near others who are dressed in the same fashion,ENTAILMENT,5,A_entails_B,B_entails_A,a woman wearing a blue and white uniform with a white and blue hat on with her mouth open near others dressed the same,a woman wearing a blue and white uniform with a white and blue hat on with her mouth open near others dressed the same,FLICKR,FLICKR,TEST	[who, are]
6908,A woman is wearing a shirt which is blue with a white vest and a white cap and is talking and marching,A woman is wearing a blue shirt with a white vest and a white cap and is talking and marching,ENTAILMENT,4.7,A_entails_B,B_entails_A,woman wearing a blue shirt with a white vest and a white cap talking while marching,woman wearing a blue shirt with a white vest and a white cap talking while marching,FLICKR,FLICKR,TEST	[which]
6918,A bearded man is standing by a shopping cart and is holding a cardboard sign,One bearded man is standing by a shopping cart and is holding a cardboard sign,ENTAILMENT,4.9,A_entails_B,B_entails_A,a bearded man is standing by a shopping cart holding up a cardboard sign,a bearded man is standing by a shopping cart holding up a cardboard sign,FLICKR,FLICKR,TRAIN	[One]
6926,The snowboarder is doing a flip over a mound of snow,A snowboarder is doing a flip over a mound of snow,ENTAILMENT,4.9,A_entails_B,B_entails_A,a snowboarder is doing a flip over a mound of snow,a snowboarder is doing a flip over a mound of snow,FLICKR,FLICKR,TEST	[]
6928,Somebody is leaping in the air on a board,Somebody is jumping in the air on a board,ENTAILMENT,4.9,A_entails_B,B_entails_A,somebody in the air on a board,somebody in the air on a board,FLICKR,FLICKR,TEST	[leaping, jumping]
6935,A large crowd in warm clothing is posing for a camera,A crowd which is large in warm clothing is posing for a camera,ENTAILMENT,4.9,A_entails_B,B_entails_A,a large crowd in heavy clothing is posing for a camera,a large crowd in heavy clothing is posing for a camera,FLICKR,FLICKR,TEST	[which]
6946,A girl who is little with blond hair is smiling and sitting on a swing,A little girl with blond hair is smiling and sitting on a swing,ENTAILMENT,4.8,A_entails_B,B_entails_A,a little girl with blond hair is smiling and sitting in a swing,a little girl with blond hair is smiling and sitting in a swing,FLICKR,FLICKR,TRAIN	[who]
6959,The man in the white hat is playing guitar on stage,A man in a white hat is playing guitar on stage,ENTAILMENT,4.9,A_entails_B,B_entails_A,a man in a white hat plays guitar on a stage,a man in a white hat plays guitar on a stage,FLICKR,FLICKR,TEST	[]
6979,A happy family is posing by the fireplace,A family which looks happy is posing by the fireplace,ENTAILMENT,4.5,A_entails_B,B_entails_A,a happy family poses by the fireplace,a happy family poses by the fireplace,FLICKR,FLICKR,TRAIN	[which, looks]
6981,The family is posing by a mantel and a Christmas tree,A family is posing by the mantel and the Christmas tree,ENTAILMENT,5,A_entails_B,B_entails_A,a family posing by the mantle and christmas tree,a family posing by the mantle and christmas tree,FLICKR,FLICKR,TRAIN	[a, the]
7006,A dog which is white is standing on fallen leaves,A white dog is standing on fallen leaves,ENTAILMENT,4.7,A_entails_B,B_entails_A,a white dog standing on fallen leaves,a white dog standing on fallen leaves,FLICKR,FLICKR,TRAIN	[which]
7008,A white dog is standing on the leaves on the ground,One white dog is standing on the leaves on the ground,ENTAILMENT,5,A_entails_B,B_entails_A,a white dog standing on leaves on the ground,a white dog standing on leaves on the ground,FLICKR,FLICKR,TRAIN	[One]
7018,A child in clothing which is light colored is standing with his arms extended outward,A child in light colored clothing is standing with his arms extended outward,ENTAILMENT,5,A_entails_B,B_entails_A,child in light colored clothing standing with arms extended outward,child in light colored clothing standing with arms extended outward,FLICKR,FLICKR,TRIAL	[which]
7026,The boy and girl are playing on the outdoor gym,A boy and a girl are playing on the outdoor gym,ENTAILMENT,5,A_entails_B,B_entails_A,the boy and girl are playing on the outdoor gym,the boy and girl are playing on the outdoor gym,FLICKR,FLICKR,TRAIN	[]
7028,Some children are playing on a playground,Some kids are playing on a playground,ENTAILMENT,4.9,A_entails_B,B_entails_A,children playing on a playground,children playing on a playground,FLICKR,FLICKR,TRAIN	[children, kids]
7048,A female wearing pink gloves and a brown jacket is smiling in the snow,The female wearing pink gloves and a brown jacket is smiling in the snow,ENTAILMENT,5,A_entails_B,B_entails_A,a female wearing pink gloves and a brown jacket is smiling in the snow,a female wearing pink gloves and a brown jacket is smiling in the snow,FLICKR,FLICKR,TEST	[]
7073,A dog with a black coat is standing in shallow water,A black dog is standing in shallow water,ENTAILMENT,4.8,A_entails_B,B_entails_A,a black dog in shallow water,a black dog in shallow water,FLICKR,FLICKR,TEST	[with, coat]
7093,The group of people is standing together and looking at the camera,A group of people is standing together and looking at the camera,ENTAILMENT,5,A_entails_B,B_entails_A,a group of people stand together and look at the camera,a group of people stand together and look at the camera,FLICKR,FLICKR,TRIAL	[]
7102,A child is sitting in a red and yellow toy car,A child is sitting in a toy car colored in red and yellow,ENTAILMENT,4.8,A_entails_B,B_entails_A,there is a child in a red and yellow toy car,there is a child in a red and yellow toy car,FLICKR,FLICKR,TEST	[colored]
7104,A small girl is riding in a toy car,The small girl is riding in the toy car,ENTAILMENT,4.9,A_entails_B,B_entails_A,small girl riding in play car,small girl riding in play car,FLICKR,FLICKR,TRAIN	[]
7115,A little boy in clothes dyed in red is jumping into the air,A little boy in red clothes is jumping into the air,ENTAILMENT,4.6,A_entails_B,B_entails_A,a little boy wearing red jumps into the air,a little boy wearing red jumps into the air,FLICKR,FLICKR,TEST	[dyed]
7122,The black dog is playing with the brown dog on the sand,A black dog is playing with a brown dog on the sand,ENTAILMENT,4.8,A_entails_B,B_entails_A,a black dog plays with a brown dog on the sand,a black dog plays with a brown dog on the sand,FLICKR,FLICKR,TEST	[]
7153,A black dog is walking through some tall grass,The black dog is walking through the tall grass,ENTAILMENT,4.9,A_entails_B,B_entails_A,the black dog is walking through the tall grass,the black dog is walking through the tall grass,FLICKR,FLICKR,TRAIN	[some]
7165,A dog is standing with its two front paws on a rock in a field,The dog is standing with its two front paws on a rock in the field,ENTAILMENT,5,A_entails_B,B_entails_A,a dog with its two front paws on a rock in a field,a dog with its two front paws on a rock in a field,FLICKR,FLICKR,TRAIN	[]
7173,A young child with hair of black color is taking a picture with a camera,A young child with black hair is taking a picture with a camera,ENTAILMENT,4.9,A_entails_B,B_entails_A,a young child with black hair is taking a picture with a canon camera,a young child with black hair is taking a picture with a canon camera,FLICKR,FLICKR,TEST	[of, color]
7184,Two boys who look small dressed in tuxedos are sitting on a red carpeted floor,Two small boys dressed in tuxedos are sitting on a red carpeted floor,ENTAILMENT,4.8,A_entails_B,B_entails_A,two small boys dressed in tuxedos sitting on a red carpeted floor,two small boys dressed in tuxedos sitting on a red carpeted floor,FLICKR,FLICKR,TEST	[who, look]
7195,The man is standing on the sidewalk,A man is standing on a sidewalk,ENTAILMENT,5,A_entails_B,B_entails_A,a man is standing on a sidewalk in the background with a blurry image of another man in the foreground,a man is standing on a sidewalk in the background with a blurry image of another man in the foreground,FLICKR,FLICKR,TEST	[]
7202,A dog with a blanket dyed in blue is running through the grass,A dog with a blue blanket is running through the grass,ENTAILMENT,4.7,A_entails_B,B_entails_A,a dog with a blue blanket runs through the grass,a dog with a blue blanket runs through the grass,FLICKR,FLICKR,TEST	[dyed, in]
7222,The person with the green shirt is jumping high over the grass,A person with a green shirt is jumping high over the grass,ENTAILMENT,4.9,A_entails_B,B_entails_A,a person with a green shirt jumps high over the grass,a person with a green shirt jumps high over the grass,FLICKR,FLICKR,TRAIN	[]
7225,A young boy is jumping in the air with his knees bent and arms spread,A boy who is young is jumping in the air with his knees bent and arms spread,ENTAILMENT,4.9,A_entails_B,B_entails_A,young boy jumping in the air with his knees bent and arms spread,young boy jumping in the air with his knees bent and arms spread,FLICKR,FLICKR,TEST	[who]
7236,A brown and white dog is leaping in the air with a tennis ball in its mouth,A brown and white dog is jumping in the air with a tennis ball in its mouth,ENTAILMENT,5,A_entails_B,B_entails_A,a brown and white dog is jumping in the air with a tennis ball in its mouth,a brown and white dog is jumping in the air with a tennis ball in its mouth,FLICKR,FLICKR,TEST	[leaping, jumping]
7244,A woman in a shirt dyed in black is sitting next to a fluorescent green bag,A woman in a black shirt is sitting next to a fluorescent green bag,ENTAILMENT,4.9,A_entails_B,B_entails_A,a woman in a black shirt is sitting next to a florescent green bag,a woman in a black shirt is sitting next to a florescent green bag,FLICKR,FLICKR,TEST	[dyed]
7255,One man is doing a wheelie on the mountain bike,The man is doing a wheelie on a mountain bike,ENTAILMENT,4.7,A_entails_B,B_entails_A,a man is doing a wheelie on a mountain bike,a man is doing a wheelie on a mountain bike,FLICKR,FLICKR,TEST	[One]
7259,A man is riding on a bicycle with one wheel only,A man on a bicycle is riding on one wheel only,ENTAILMENT,4.8,A_entails_B,B_entails_A,man on a bicycle riding on only one wheel,man on a bicycle riding on only one wheel,FLICKR,FLICKR,TEST	[with]
7266,A duck with brown feathers and a green head is flapping its wings in the water,A brown duck with a green head is flapping its wings in the water,ENTAILMENT,4.7,A_entails_B,B_entails_A,a brown duck with a green head flaps its wings in the water,a brown duck with a green head flaps its wings in the water,FLICKR,FLICKR,TEST	[feathers, and]
7275,The dog with the brown coat is playing outdoors,The brown dog is playing outdoors,ENTAILMENT,4.8,A_entails_B,B_entails_A,the brown dog is playing outdoors,the brown dog is playing outdoors,FLICKR,FLICKR,TEST	[with, coat]
7277,A furry brown dog is running through the grassy area,The furry brown dog is running through the grassy area,ENTAILMENT,5,A_entails_B,B_entails_A,the furry brown dog is running through the grassy area,the furry brown dog is running through the grassy area,FLICKR,FLICKR,TRAIN	[]
7284,A woman in a fur hat and fur coat is standing outside a building,A lady in a fur hat and fur coat is standing outside a building,ENTAILMENT,4.8,A_entails_B,B_entails_A,a woman in a fur hat and fur coat stands outside a building,a woman in a fur hat and fur coat stands outside a building,FLICKR,FLICKR,TEST	[woman, lady]
7295,A young child is running down a gravel road that is covered with dead leaves,A young child is running down a road made of gravel that is covered with dead leaves,ENTAILMENT,4.8,A_entails_B,B_entails_A,a young child runs down a gravel road covered with dead leaves,a young child runs down a gravel road covered with dead leaves,FLICKR,FLICKR,TEST	[made, of]
7297,One young child is running outside over some fallen leaves,A young child is running outside over the fallen leaves,ENTAILMENT,4.6,A_entails_B,B_entails_A,a young child runs outside amidst fall leaves,a young child runs outside amidst fall leaves,FLICKR,FLICKR,TEST	[One, some]
7337,One man is climbing a rock wall and another man is holding a rope,One man is climbing a wall made of rock and another man is holding a rope,ENTAILMENT,4.9,A_entails_B,B_entails_A,one man is climbing a rock wall while another man below holds a rope,one man is climbing a rock wall while another man below holds a rope,FLICKR,FLICKR,TEST	[made, of]
7348,Small kids are climbing a statue in a park,Small children are climbing a statue in a park,ENTAILMENT,4.9,A_entails_B,B_entails_A,small children climb a statue in a park,small children climb a statue in a park,FLICKR,FLICKR,TEST	[kids, children]
7359,A woman is looking at the view of a city,The woman is looking at the view of a city,ENTAILMENT,4.9,A_entails_B,B_entails_A,a woman looking at view of a city,a woman looking at view of a city,FLICKR,FLICKR,TRAIN	[]
7366,A person is standing on a mountain top,Somebody is standing on a mountain top,ENTAILMENT,4.9,A_entails_B,B_entails_A,a person stands on a mountain top,a person stands on a mountain top,FLICKR,FLICKR,TEST	[person, Somebody]
7368,A man is standing on the top of the rocks with clouds behind them,One man is standing on the top of the rocks with clouds behind them,ENTAILMENT,4.7,A_entails_B,B_entails_A,a man at the top of rocks clouds behind,a man at the top of rocks clouds behind,FLICKR,FLICKR,TRAIN	[One]
7377,The smiling boy in winter clothes is waving his mittened hands outside the building in the snow,A smiling boy in winter clothes is waving his mittened hands outside a building in the snow,ENTAILMENT,5,A_entails_B,B_entails_A,a smiling boy in winter clothes waves his mittened hands outside a building in the snow,a smiling boy in winter clothes waves his mittened hands outside a building in the snow,FLICKR,FLICKR,TEST	[]
7379,A child who is young dressed for cold weather is standing outside,A young child dressed for cold weather is standing outside,ENTAILMENT,5,A_entails_B,B_entails_A,a young child dressed for cold weather is outside,a young child dressed for cold weather is outside,FLICKR,FLICKR,TEST	[who]
7386,A kid is smiling at the camera and swimming underwater,A child is smiling at the camera and swimming underwater,ENTAILMENT,4.7,A_entails_B,B_entails_A,a child smiling at the camera while swimming underwater,a child smiling at the camera while swimming underwater,FLICKR,FLICKR,TRAIN	[kid, child]
7395,A man and a child are kayaking through gentle waters,The man and the child are kayaking through gentle waters,ENTAILMENT,5,A_entails_B,B_entails_A,a man and child kayak through gentle waters,a man and child kayak through gentle waters,FLICKR,FLICKR,TEST	[]
7404,An American footballer is wearing the red and white strip,The American footballer is wearing a red and white strip,ENTAILMENT,4.9,A_entails_B,B_entails_A,the american footballer is wearing a red and white strip,the american footballer is wearing a red and white strip,FLICKR,FLICKR,TRAIN	[An]
7423,A dog is chasing a ball on the grass,A dog is chasing a ball in the grass,ENTAILMENT,4.9,A_entails_B,B_entails_A,a dog chases a nerf ball in the grass,dog chasing after a ball on the grass,FLICKR,FLICKR,TRAIN	[on, in]
7426,A tan dog is jumping up and catching a tennis ball,A dog with a tan coat is jumping up and catching a tennis ball,ENTAILMENT,4.9,A_entails_B,B_entails_A,a tan dog jumps up to catch a tennis ball,a tan dog jumps up to catch a tennis ball,FLICKR,FLICKR,TEST	[with, coat]
7433,A man is sitting on a train and resting his hand against his face,The man is sitting on the train and resting his hand against his face,ENTAILMENT,4.9,A_entails_B,B_entails_A,a man is sitting on a train resting his hand against his face,a man is sitting on a train resting his hand against his face,FLICKR,FLICKR,TEST	[]
