pair_ID,sentence_A,sentence_B,entailment_label,relatedness_score,entailment_AB,entailment_BA,sentence_A_original,sentence_B_original,sentence_A_dataset,sentence_B_dataset,SemEval_set	[sentence_A, sentence_B]
3364,A woman is cleaning a shrimp,The woman is cleaning a shrimp,ENTAILMENT,4.9,A_entails_B,B_entails_A,a woman is cleaning a shrimp,a woman is cleaning a shrimp,SEMEVAL,SEMEVAL,TRIAL	[]
3366,Someone is cleaning an animal,Someone is cleansing an animal,ENTAILMENT,4.5,A_entails_B,B_entails_A,someone is cleaning a animal,someone is cleaning a animal,SEMEVAL,SEMEVAL,TRAIN	[cleaning, cleansing]
3386,One panda is eating a bamboo cane,The panda is eating bamboo,ENTAILMENT,4.6,A_entails_B,B_entails_A,a pankda is eating bamboo,a pankda is eating bamboo,SEMEVAL,SEMEVAL,TRAIN	[One, cane]
3392,A panda bear is eating some bamboo,The panda is eating bamboo,ENTAILMENT,4.9,A_entails_B,B_entails_A,a panda bear is eating some bamboo,a pankda is eating bamboo,SEMEVAL,SEMEVAL,TEST	[bear, some]
3393,Someone is beating an egg,Somebody is beating an egg,ENTAILMENT,4.8,A_entails_B,B_entails_A,someone is beating an egg,someone is beating an egg,SEMEVAL,SEMEVAL,TEST	[Someone, Somebody]
3395,The woman is stirring eggs in a bowl,The lady is stirring eggs in a bowl,ENTAILMENT,4.9,A_entails_B,B_entails_A,a woman stirs eggs in a bowl,a woman stirs eggs in a bowl,SEMEVAL,SEMEVAL,TRAIN	[woman, lady]
3411,The man is catching a fish,A man is catching a fish,ENTAILMENT,4.9,A_entails_B,B_entails_A,a man catches a fish,a man catches a fish,SEMEVAL,SEMEVAL,TRAIN	[]
3422,A man is playing a harp,The man is playing a harp,ENTAILMENT,5,A_entails_B,B_entails_A,a man is playing a harp,a man is playing a harp,SEMEVAL,SEMEVAL,TRAIN	[]
3451,One man is chopping a log with an axe,A man is chopping a log with an axe,ENTAILMENT,4.9,A_entails_B,B_entails_A,a man is chopping a log with an axe,a man is chopping a log with an axe,SEMEVAL,SEMEVAL,TRAIN	[One]
3453,The man is chopping the trunk of a tree with an axe,The man is chopping a tree trunk with an axe,ENTAILMENT,4.9,A_entails_B,B_entails_A,a man is chopping a tree trunk with an axe,a man is chopping a tree trunk with an axe,SEMEVAL,SEMEVAL,TRAIN	[of]
3471,The man is thinking,A man is thinking,ENTAILMENT,5,A_entails_B,B_entails_A,a man is thinking,a man is thinking,SEMEVAL,SEMEVAL,TRAIN	[]
3480,A cat with a white coat perched on a small wooden cabinet is looking outside the window,A white cat perched on a small wooden cabinet is looking outside the window,ENTAILMENT,4.8,A_entails_B,B_entails_A,a white cat perched on a small wooden cabinet is looking outside the window,a white cat perched on a small wooden cabinet is looking outside the window,SEMEVAL,SEMEVAL,TRAIN	[with, coat]
3483,The cat perched on the table is looking out the window,The cat perched on the table is looking curiously out the window,ENTAILMENT,4.8,A_entails_B,B_entails_A,a cat perched on a table looks out the window,a cat perched on a table looks out the window,SEMEVAL,SEMEVAL,TEST	[curiously]
3493,The dog is licking the baby,A dog is licking a baby,ENTAILMENT,5,A_entails_B,B_entails_A,a dog is licking a baby,a dog is licking a baby,SEMEVAL,SEMEVAL,TEST	[]
3501,A dog is licking a baby,The dog is licking the baby,ENTAILMENT,4.8,A_entails_B,B_entails_A,a dog licks a baby,a dog is licking a baby,SEMEVAL,SEMEVAL,TRIAL	[]
3513,The woman is dancing,A woman is dancing,ENTAILMENT,4.9,A_entails_B,B_entails_A,a woman is dancing,a woman is dancing,SEMEVAL,SEMEVAL,TEST	[]
3522,The person is writing,A person is writing,ENTAILMENT,4.9,A_entails_B,B_entails_A,a person is writing,a person is writing,SEMEVAL,SEMEVAL,TEST	[]
3533,Somebody is boiling okra in a pot,Someone is boiling okra in a pot,ENTAILMENT,4.8,A_entails_B,B_entails_A,someone is boiling okra in a pot,someone is boiling okra in a pot,SEMEVAL,SEMEVAL,TRAIN	[Somebody, Someone]
3544,The man is dancing,A man is dancing,ENTAILMENT,4.9,A_entails_B,B_entails_A,a man is dancing,a man is dancing,SEMEVAL,SEMEVAL,TRAIN	[]
3563,A squirrel is running around in circles,A squirrel is spinning around in circles,ENTAILMENT,4.4,A_entails_B,B_entails_A,a squirrel is spinning around in circles,a squirrel runs around in circles,SEMEVAL,SEMEVAL,TEST	[running, spinning]
3575,The man is playing the flute,A man is playing a flute,ENTAILMENT,4.8,A_entails_B,B_entails_A,a man is playing a flute,a man is playing a flute,SEMEVAL,SEMEVAL,TEST	[]
3586,A man is playing the drum,A man is practicing the drum,ENTAILMENT,4.6,A_entails_B,B_entails_A,a man plays the drum,a man plays the drum,SEMEVAL,SEMEVAL,TRIAL	[playing, practicing]
3592,A man is playing the drums,A man is playing the drum,ENTAILMENT,4.8,A_entails_B,B_entails_A,a man is playing the drums,a man plays the drum,SEMEVAL,SEMEVAL,TRAIN	[drums, drum]
3595,The man is doing floor exercises,One man is doing floor exercises,ENTAILMENT,4.9,A_entails_B,B_entails_A,a man does floor exercises,a man does floor exercises,SEMEVAL,SEMEVAL,TEST	[One]
3606,A monkey is riding a bike,A monkey is riding a bicycle,ENTAILMENT,4.9,A_entails_B,B_entails_A,a monkey is riding a bike,a monkey is riding a bike,SEMEVAL,SEMEVAL,TEST	[bike, bicycle]
3615,One fish is swimming ,A fish is swimming,ENTAILMENT,4.9,A_entails_B,B_entails_A,a fish is swimming,a fish is swimming,SEMEVAL,SEMEVAL,TEST	[One]
3647,The boys are standing in front of the car which is burning,The boys are standing in front of the burning car,ENTAILMENT,5,A_entails_B,B_entails_A,four boys are standing in front of the burning car,four boys are standing in front of the burning car,SEMEVAL,SEMEVAL,TRAIN	[which, is]
3659,A woman is collecting tap water in a mug,A woman is collecting the water from a tap in a mug,ENTAILMENT,4.8,A_entails_B,B_entails_A,a woman is collecting tap water in a mug,a woman is collecting tap water in a mug,SEMEVAL,SEMEVAL,TEST	[from]
3668,A man is strolling in the rain,A man is walking in the rain,ENTAILMENT,5,A_entails_B,B_entails_A,a man is walking in the rain,a man is walking in the rain,SEMEVAL,SEMEVAL,TRAIN	[strolling, walking]
3698,The men are putting suitcases into the trunk of a car,The men are packing suitcases into the trunk of a car,ENTAILMENT,5,A_entails_B,B_entails_A,two men are packing suitcases into the trunk of a car,the men are putting suitcases into the car's trunk,SEMEVAL,SEMEVAL,TEST	[putting, packing]
3701,A woman is putting make-up on,The woman is putting make-up on,ENTAILMENT,4.8,A_entails_B,B_entails_A,a woman puts make-up on,a woman puts make-up on,SEMEVAL,SEMEVAL,TRAIN	[]
3710,A toy train is striking a toy car,A toy train is hitting a toy car,ENTAILMENT,4.8,A_entails_B,B_entails_A,a toy train strikes a toy car,a toy train strikes a toy car,SEMEVAL,SEMEVAL,TRAIN	[striking, hitting]
3719,The person is peeling an onion,A person is peeling an onion,ENTAILMENT,4.9,A_entails_B,B_entails_A,a person is peeling an onion,a person is peeling an onion,SEMEVAL,SEMEVAL,TRAIN	[]
3750,A boy is looking at a calendar,A boy is staring at a calendar,ENTAILMENT,4.2,A_entails_B,B_entails_A,a boy is looking at a calendar,a boy is looking at a calendar,SEMEVAL,SEMEVAL,TRAIN	[looking, staring]
3752,The boy is studying a calendar,A boy is studying a calendar,ENTAILMENT,5,A_entails_B,B_entails_A,a boy studies a calendar,a boy studies a calendar,SEMEVAL,SEMEVAL,TRAIN	[]
3768,A woman is picking up and holding a baby kangaroo in her arms,A woman is picking up and holding a kangaroo which is a baby in her arms,ENTAILMENT,4.9,A_entails_B,B_entails_A,a woman picks up and holds a baby kangaroo in her arms,a woman picks up and holds a baby kangaroo in her arms,SEMEVAL,SEMEVAL,TEST	[which]
3770,The woman is taking up and holding a baby kangaroo,The woman is picking up and holding a baby kangaroo,ENTAILMENT,4.4,A_entails_B,B_entails_A,a woman picks up and holds a baby kangaroo,a woman picks up and holds a baby kangaroo,SEMEVAL,SEMEVAL,TRAIN	[taking, picking]
3777,A woman is dancing and a man is playing the keyboard,The woman is dancing and a man is playing the keyboard,ENTAILMENT,4.9,A_entails_B,B_entails_A,a woman dances while a man plays the keyboard,a woman dances while a man plays the keyboard,SEMEVAL,SEMEVAL,TRAIN	[]
3790,A person is scrubbing a zucchini,The person is scrubbing a zucchini,ENTAILMENT,5,A_entails_B,B_entails_A,a person is scrubbing a zucchini,a person is scrubbing a zucchini,SEMEVAL,SEMEVAL,TRIAL	[]
3801,A man in a cap is playing a harp,A man in a hat is playing a harp,ENTAILMENT,5,A_entails_B,B_entails_A,a man in a hat is playing a harp,a man in a hat is playing a harp,SEMEVAL,SEMEVAL,TRAIN	[cap, hat]
3812,A woman is slicing a pepper which is green,A woman is slicing a green pepper,ENTAILMENT,4.8,A_entails_B,B_entails_A,a women slicing green pepper,a women slicing green pepper,SEMEVAL,SEMEVAL,TRIAL	[which]
3825,The woman is playing a flute,A woman is playing a flute,ENTAILMENT,5,A_entails_B,B_entails_A,a woman plays on a flute,a woman plays on a flute,SEMEVAL,SEMEVAL,TRAIN	[]
3827,A woman is playing flute,The woman is playing a flute,ENTAILMENT,4.9,A_entails_B,B_entails_A,a woman is playing flute,a woman plays on a flute,SEMEVAL,SEMEVAL,TRAIN	[]
3831,A woman is playing a flute,A woman is playing flute,ENTAILMENT,4.9,A_entails_B,B_entails_A,a woman is playing flute,a woman plays on a flute,SEMEVAL,SEMEVAL,TRAIN	[]
3846,The cat is playing keyboards,A cat is playing keyboards,ENTAILMENT,5,A_entails_B,B_entails_A,a cat is playing keyboards,a cat is playing keyboards,SEMEVAL,SEMEVAL,TRAIN	[]
3853,A cat is playing a piano,A cat is playing keyboards,ENTAILMENT,4.4,A_entails_B,B_entails_A,a cat is playing a piano,a cat is playing keyboards,SEMEVAL,SEMEVAL,TRAIN	[piano, keyboards]
3856,The man is walking along a path through the wilderness,The man is walking along a track through the wilderness,ENTAILMENT,4.7,A_entails_B,B_entails_A,a man is walking along a path through wilderness,a man is walking along a path through wilderness,SEMEVAL,SEMEVAL,TRAIN	[path, track]
3867,The man is rising from a swamp,A man is rising from a swamp,ENTAILMENT,5,A_entails_B,B_entails_A,a man rises from a swamp,a man rises from a swamp,SEMEVAL,SEMEVAL,TEST	[]
3878,A man is dancing upside-down on the ceiling,The man is dancing upside-down on the ceiling,ENTAILMENT,5,A_entails_B,B_entails_A,a man is dancing upside-down on the ceiling,a man is dancing upside-down on the ceiling,SEMEVAL,SEMEVAL,TEST	[]
3885,A man is dancing,A male is dancing,ENTAILMENT,4.6,A_entails_B,B_entails_A,a man is dancing,a man is dancing,SEMEVAL,SEMEVAL,TRAIN	[man, male]
3894,The girl is exercising,A girl is exercising,ENTAILMENT,5,A_entails_B,B_entails_A,a girl is exercising,a girl is exercising,SEMEVAL,SEMEVAL,TEST	[]
3934,The boy is checking a calendar,A boy is checking a calendar,ENTAILMENT,4.9,A_entails_B,B_entails_A,a boy is checking a calender,a boy is checking a calender,SEMEVAL,SEMEVAL,TRAIN	[]
3952,A biker is riding along the top of a fence,The biker is riding along the top of a fence,ENTAILMENT,4.9,A_entails_B,B_entails_A,a bmx biker rides along the top of a fence,a bmx biker rides along the top of a fence,SEMEVAL,SEMEVAL,TEST	[]
3954,The boy is riding a bike on the top of a fence made of metal,The boy is riding a bike on the top of a metal fence,ENTAILMENT,4.9,A_entails_B,B_entails_A,a boy rode his bike on top of a metal fence,a boy rode his bike on top of a metal fence,SEMEVAL,SEMEVAL,TEST	[made]
3963,A woman is slicing a pepper which is big,A woman is slicing a big pepper,ENTAILMENT,4.9,A_entails_B,B_entails_A,a woman is slicing a big pepper,a woman is slicing a big pepper,SEMEVAL,SEMEVAL,TEST	[which]
3965,The woman is slicing a clove of garlic,A woman is slicing a clove of garlic,ENTAILMENT,4.8,A_entails_B,B_entails_A,a woman is slicing a garlic,a woman is slicing a garlic,SEMEVAL,SEMEVAL,TEST	[]
3981,A woman is peeling a potato,The woman is peeling a potato,ENTAILMENT,5,A_entails_B,B_entails_A,a woman is peeling a potato,a woman is peeling a potato,SEMEVAL,SEMEVAL,TEST	[]
4004,A man is climbing up a rope,The man is climbing up a rope,ENTAILMENT,4.9,A_entails_B,B_entails_A,a man climbs up a rope,a man climbs up a rope,SEMEVAL,SEMEVAL,TRAIN	[]
4006,A man is climbing a rope,The man is climbing up a rope,ENTAILMENT,4.8,A_entails_B,B_entails_A,a man is climbing a rope,a man climbs up a rope,SEMEVAL,SEMEVAL,TRIAL	[up]
4011,A man is climbing a rope,A man is climbing up a rope,ENTAILMENT,4.8,A_entails_B,B_entails_A,a man is climbing a rope,a man climbs up a rope,SEMEVAL,SEMEVAL,TRIAL	[up]
4015,The lady is picking up the kangaroo,The woman is picking up the kangaroo,ENTAILMENT,4.9,A_entails_B,B_entails_A,the woman picked up the kangaroo,the woman picked up the kangaroo,SEMEVAL,SEMEVAL,TRIAL	[lady, woman]
4036,A person is riding a jetski in the waves,The person is riding a jetski in the waves,ENTAILMENT,5,A_entails_B,B_entails_A,a person is riding a jetski in the waves,a person is riding a jetski in the waves,SEMEVAL,SEMEVAL,TRAIN	[]
4056,A man is running on the road,The man is running on the road,ENTAILMENT,4.8,A_entails_B,B_entails_A,a man is running on the road,a man is running on the road,SEMEVAL,SEMEVAL,TRAIN	[]
4063,A man is outside and is throwing blades at a target which is close,A man is outside and is throwing blades at a close target,ENTAILMENT,4.8,A_entails_B,B_entails_A,a man is throwing blades into a close target outside,a man is throwing blades into a close target outside,SEMEVAL,SEMEVAL,TRAIN	[which]
4066,The man is hurling knives at a tree,The man is throwing knives at a tree,ENTAILMENT,4.6,A_entails_B,B_entails_A,the man is throwing knives at a tree,the man is throwing knives at a tree,SEMEVAL,SEMEVAL,TRIAL	[hurling, throwing]
4076,One man is riding a horse,The man is riding a horse,ENTAILMENT,5,A_entails_B,B_entails_A,the man is riding a horse,the man is riding a horse,SEMEVAL,SEMEVAL,TRAIN	[One]
4079,One man is riding a horse,A man is riding a horse,ENTAILMENT,4.7,A_entails_B,B_entails_A,a man is riding on a horse,the man is riding a horse,SEMEVAL,SEMEVAL,TRIAL	[One]
4084,The man is riding a horse,A man is riding a horse,ENTAILMENT,5,A_entails_B,B_entails_A,a man is riding on a horse,the man is riding a horse,SEMEVAL,SEMEVAL,TRAIN	[]
4100,Someone is playing the guitar,Somebody is playing the guitar,ENTAILMENT,4.8,A_entails_B,B_entails_A,someone is playing guitar,someone is playing guitar,SEMEVAL,SEMEVAL,TRAIN	[Someone, Somebody]
4116,A cute panda is lying down,A panda that is cute is lying down,ENTAILMENT,4.9,A_entails_B,B_entails_A,a panda is lying down,a panda is lying down,SEMEVAL,SEMEVAL,TEST	[that]
4118,The panda bear is resting on the logs,The panda bear is lying on the logs,ENTAILMENT,4.7,A_entails_B,B_entails_A,the panda bear lay on the logs,the panda bear lay on the logs,SEMEVAL,SEMEVAL,TRAIN	[resting, lying]
4127,A dog is jumping on a trampoline,A dog is bouncing on a trampoline,ENTAILMENT,5,A_entails_B,B_entails_A,a dog bounces on a trampoline,a dog bounces on a trampoline,SEMEVAL,SEMEVAL,TRAIN	[jumping, bouncing]
4135,A dog is bouncing on a trampoline,A dog is jumping on a trampoline,ENTAILMENT,4.7,A_entails_B,B_entails_A,a dog bounces on a trampoline,a dog is jumping on a trampoline,SEMEVAL,SEMEVAL,TRIAL	[bouncing, jumping]
4145,A woman is slicing an onion,A woman is cutting an onion,ENTAILMENT,4.9,A_entails_B,B_entails_A,a woman is cutting an onion,a woman is cutting an onion,SEMEVAL,SEMEVAL,TRAIN	[slicing, cutting]
4163,The man is cleaning the drawing on the board,The man is erasing the drawing on the board,ENTAILMENT,4.6,A_entails_B,B_entails_A,the man erased the work on the board,the man erased the work on the board,SEMEVAL,SEMEVAL,TRAIN	[cleaning, erasing]
4165,The man is erasing the other man's work from the board,The man is erasing the other man's work from the panel,ENTAILMENT,4.4,A_entails_B,B_entails_A,the man erased what the other man had on the board,the man erased what the other man had on the board,SEMEVAL,SEMEVAL,TRAIN	[board, panel]
4172,A woman is cutting a vegetable,A woman is slicing a vegetable,ENTAILMENT,4.7,A_entails_B,B_entails_A,a woman cuts up a vegetable,a woman cuts up a vegetable,SEMEVAL,SEMEVAL,TEST	[cutting, slicing]
4201,A man is slicing some bread,A man is slicing bread,ENTAILMENT,5,A_entails_B,B_entails_A,a man is slicing bread,a man is slicing bread,SEMEVAL,SEMEVAL,TEST	[some]
4266,A man is rapidly chopping some mushrooms with a knife,A man is quickly chopping some mushrooms with a knife,ENTAILMENT,4.9,A_entails_B,B_entails_A,a man is rapidly chopping some mushrooms using a knife,a man is rapidly chopping some mushrooms using a knife,SEMEVAL,SEMEVAL,TRAIN	[rapidly, quickly]
4268,A person is quickly cutting mushrooms with a knife,A person is quickly chopping mushrooms with a knife,ENTAILMENT,4.9,A_entails_B,B_entails_A,a person is quickly chopping mushrooms with a knife,a person is quickly chopping mushrooms with a knife,SEMEVAL,SEMEVAL,TEST	[cutting, chopping]
4277,An old woman is shaking hands with a man,An woman that is old is shaking hands with a man,ENTAILMENT,4.9,A_entails_B,B_entails_A,an old woman is shaking hand with a man,an old woman is shaking hand with a man,SEMEVAL,SEMEVAL,TRAIN	[that]
4286,The woman is slicing cooked octopus,The woman is cutting cooked octopus,ENTAILMENT,5,A_entails_B,B_entails_A,the woman is cutting cooked octopus,the woman is cutting cooked octopus,SEMEVAL,SEMEVAL,TEST	[slicing, cutting]
4295,An airplane is taking off,An aircraft is taking off,ENTAILMENT,4.8,A_entails_B,B_entails_A,an air plane is taking off,an air plane is taking off,SEMEVAL,SEMEVAL,TRAIN	[airplane, aircraft]
4311,A man is cutting a potato,A man is slicing a potato,ENTAILMENT,4.8,A_entails_B,B_entails_A,a man is cutting a potato,a man is cutting a potato,SEMEVAL,SEMEVAL,TEST	[cutting, slicing]
4313,A woman is slicing a tomato,A woman is cutting a tomato,ENTAILMENT,4.9,A_entails_B,B_entails_A,a woman is cutting a tomato,a woman is cutting a tomato,SEMEVAL,SEMEVAL,TEST	[slicing, cutting]
4332,A man is drawing,The man is drawing,ENTAILMENT,5,A_entails_B,B_entails_A,a man is drawing,the man is drawing,SEMEVAL,SEMEVAL,TEST	[]
4382,A man is tying a shoe,A man is tying the shoe,ENTAILMENT,4.8,A_entails_B,B_entails_A,a man ties a shoe,a man ties a shoe,SEMEVAL,SEMEVAL,TRAIN	[]
4406,A man is cutting a paper plate,The man is cutting a paper plate,ENTAILMENT,5,A_entails_B,B_entails_A,the man cut a paper plate,a man is cutting a paper plate,SEMEVAL,SEMEVAL,TEST	[]
4537,A cat is sliding upside down under a sofa,A cat is sliding upside down under a couch,ENTAILMENT,4.9,A_entails_B,B_entails_A,a cat is sliding upside down under a couch,a cat is sliding upside down under a couch,SEMEVAL,SEMEVAL,TEST	[sofa, couch]
4553,A man is emptying a container made of plastic,A man is emptying a plastic container,ENTAILMENT,4.9,A_entails_B,B_entails_A,a man is emptying a plastic container,a man is emptying a plastic container,SEMEVAL,SEMEVAL,TRAIN	[made, of]
4564,Two men are battling,Two men are fighting,ENTAILMENT,4.8,A_entails_B,B_entails_A,two men are fighting,two men are fighting,SEMEVAL,SEMEVAL,TRAIN	[battling, fighting]
4618,The boy is cutting the grass by the curb with scissors,The boy is shortening the grass by the curb with scissors,ENTAILMENT,4.8,A_entails_B,B_entails_A,the boy cut the grass by the curb with scissors,the boy cut the grass by the curb with scissors,SEMEVAL,SEMEVAL,TEST	[cutting, shortening]
4643,A man is cutting a cord with a sword,A man is cutting a rope with a sword,ENTAILMENT,4.5,A_entails_B,B_entails_A,a man is cutting a rope with a sword,a man is cutting a rope with a sword,SEMEVAL,SEMEVAL,TRAIN	[cord, rope]
4654,A man is walking along a path through a wilderness,A man is walking along a track through a wilderness,ENTAILMENT,4.6,A_entails_B,B_entails_A,a man is walking along a path through wilderness,a man is walking along a path through wilderness,SEMEVAL,SEMEVAL,TEST	[path, track]
4661,A woman is slicing a potato,A woman is cutting a potato,ENTAILMENT,4.8,A_entails_B,B_entails_A,a woman is cutting a potato,a woman is cutting a potato,SEMEVAL,SEMEVAL,TRIAL	[slicing, cutting]
4683,A woman is slicing garlic,A woman is cutting garlic,ENTAILMENT,4.9,A_entails_B,B_entails_A,a woman is slicing garlics,a woman is slicing garlics,SEMEVAL,SEMEVAL,TRAIN	[slicing, cutting]
4690,A man is holding a small animal in one hand,A man is holding an animal which is small in one hand,ENTAILMENT,4.8,A_entails_B,B_entails_A,a man holds a small animal in one hand,a man holds a small animal in one hand,SEMEVAL,SEMEVAL,TEST	[an, which]
4720,A monkey is practicing martial arts,A chimp is practicing martial arts,ENTAILMENT,4.5,A_entails_B,B_entails_A,a monkey pratices martial arts,a monkey pratices martial arts,SEMEVAL,SEMEVAL,TRAIN	[monkey, chimp]
4728,A man is fixing a silencer to a gun,A man is applying a silencer to a gun,ENTAILMENT,4.485,A_entails_B,B_entails_A,a man is adding a silencer to a gun,a man is adding a silencer to a gun,SEMEVAL,SEMEVAL,TRAIN	[fixing, applying]
4730,A man is fitting a silencer to a pistol,A man is fitting a silencer to a weapon,ENTAILMENT,4.6,A_entails_B,B_entails_A,a man is fitting silencer on a pistol,a man is fitting silencer on a pistol,SEMEVAL,SEMEVAL,TEST	[pistol, weapon]
4750,The girl is sitting on the couch and is crocheting,The girl is sitting on the sofa and crocheting,ENTAILMENT,5,A_entails_B,B_entails_A,the girl sat on the couch to crochet,the girl sat on the couch to crochet,SEMEVAL,SEMEVAL,TEST	[couch, sofa]
4766,A man is cooking a snake,A man is roasting a snake,ENTAILMENT,4.7,A_entails_B,B_entails_A,a man is preparing a snake for cooking,a man is preparing a snake for cooking,SEMEVAL,SEMEVAL,TRAIN	[cooking, roasting]
4777,A little boy is playing a guitar,A young boy is playing a guitar,ENTAILMENT,4.6,A_entails_B,B_entails_A,a little boy is playing a guitar,a little boy is playing a guitar,SEMEVAL,SEMEVAL,TRAIN	[little, young]
4815,A person is slicing some ginger,A person is cutting some ginger,ENTAILMENT,4.9,A_entails_B,B_entails_A,a person cuts ginger,a person cuts ginger,SEMEVAL,SEMEVAL,TRAIN	[slicing, cutting]
4826,A man is slicing a potato into pieces,A man is cutting a potato into pieces,ENTAILMENT,4.6,A_entails_B,B_entails_A,a man is slicing a potato into pieces,a man is slicing a potato into pieces,SEMEVAL,SEMEVAL,TRAIN	[slicing, cutting]
4830,A man is slicing a potato,A man is slicing a potato into pieces,ENTAILMENT,4.9,A_entails_B,B_entails_A,a man is slicing a potato into pieces,a man is cutting a potato,SEMEVAL,SEMEVAL,TEST	[into, pieces]
4869,A woman is cutting potatoes,A woman is slicing potatoes,ENTAILMENT,4.9,A_entails_B,B_entails_A,a woman is cutting potatoes,a woman is cutting potatoes,SEMEVAL,SEMEVAL,TRAIN	[cutting, slicing]
4923,A person is cutting garlic into pieces with a knife,A person is slicing garlic into pieces with a knife,ENTAILMENT,4.815,A_entails_B,B_entails_A,a person is cutting garlic into pieces with a knife,a person is cutting garlic into pieces with a knife,SEMEVAL,SEMEVAL,TEST	[cutting, slicing]
4935,The military officer is shouting at the recruits,The military officer is barking at the recruits,ENTAILMENT,4.8,A_entails_B,B_entails_A,the military officer barked at the recruits,the military officer barked at the recruits,SEMEVAL,SEMEVAL,TEST	[shouting, barking]
4965,A woman is cutting a fish,A woman is slicing a fish,ENTAILMENT,5,A_entails_B,B_entails_A,a woman slices a fish,a woman slices a fish,SEMEVAL,SEMEVAL,TRAIN	[cutting, slicing]
4999,A big cat is opening a drawer made of plastic with its paws and is jumping inside,A big cat is opening a plastic drawer with its paws and is jumping inside,ENTAILMENT,4.9,A_entails_B,B_entails_A,a big cat opens a plastic drawer with his paws and then hops inside,a big cat opens a plastic drawer with his paws and then hops inside,SEMEVAL,SEMEVAL,TEST	[made, of]
5008,A man is cutting an onion,A man is chopping an onion,ENTAILMENT,4.8,A_entails_B,B_entails_A,a man is cutting an onion,a man is cutting an onion,SEMEVAL,SEMEVAL,TEST	[cutting, chopping]
5028,The man is speaking on the phone,The man is talking on the phone,ENTAILMENT,4.8,A_entails_B,B_entails_A,the man is talking on the phone,the man is talking on the phone,SEMEVAL,SEMEVAL,TEST	[speaking, talking]
5030,The man is talking on the telephone,The man is speaking on the telephone,ENTAILMENT,4.9,A_entails_B,B_entails_A,the man talked on the telephone,the man talked on the telephone,SEMEVAL,SEMEVAL,TRIAL	[talking, speaking]
5038,The man is talking on the telephone,The man is talking on the phone,ENTAILMENT,4.8,A_entails_B,B_entails_A,the man is talking on the phone,the man talked on the telephone,SEMEVAL,SEMEVAL,TEST	[telephone, phone]
5039,A man is slicing onions,A man is cutting onions,ENTAILMENT,4.9,A_entails_B,B_entails_A,a man is cutting onions,a man is cutting onions,SEMEVAL,SEMEVAL,TRAIN	[slicing, cutting]
5061,A man is chopping a potato,A man is cutting a potato,ENTAILMENT,4.6,A_entails_B,B_entails_A,a man cuts a potato,a man is slicing a potato,SEMEVAL,SEMEVAL,TEST	[chopping, cutting]
5065,A man is slicing a potato,A man is cutting a potato,ENTAILMENT,4.9,A_entails_B,B_entails_A,a man cuts a potato,a man is slicing a potato,SEMEVAL,SEMEVAL,TEST	[slicing, cutting]
5104,A chef is preparing a meal,A chef is cooking a meal,ENTAILMENT,4.5,A_entails_B,B_entails_A,a chef prepared a meal,a chef prepared a meal,SEMEVAL,SEMEVAL,TEST	[preparing, cooking]
5113,Two sumo ringers are fighting,Two sumo wrestlers are fighting,ENTAILMENT,4,A_entails_B,B_entails_A,two sumo ringers are fighting each other,two sumo ringers are fighting each other,SEMEVAL,SEMEVAL,TRIAL	[ringers, wrestlers]
5129,A man is sprinkling shredded cheese on a pizza,A man is sprinkling cheese on a pizza,ENTAILMENT,4.7,A_entails_B,B_entails_A,a man is sprinkling shredded cheese on a pizza,a man is sprinkling shredded cheese on a pizza,SEMEVAL,SEMEVAL,TEST	[shredded]
