8040	A young girl is jumping into a still lake	A young boy is jumping into a still lake	NEUTRAL	3.5	A_neutral_B	B_neutral_A	a young boy jumping into a still lake	a young boy jumping into a still lake	FLICKR	FLICKR	TRAIN	A:girl,B:boy,
8047	Two people are carrying colorful baskets and blankets and walking near a building	Two people are carrying gray baskets and blankets and walking near a building	NEUTRAL	3.5	A_neutral_B	B_neutral_A	two people carrying colorful baskets and blankets walk near a building	two people carrying colorful baskets and blankets walk near a building	FLICKR	FLICKR	TRAIN	A:colorful,B:gray,
8049	Two people are sitting with laden baskets and blankets	Two people are walking with laden baskets and blankets	NEUTRAL	4.2	A_contradicts_B	B_neutral_A	two people walking laden down with baskets and blankets	two people walking laden down with baskets and blankets	FLICKR	FLICKR	TRAIN	A:sitting,B:walking,
8056	A young girl is sitting in swimming gear	A young man is sitting in swimming gear	NEUTRAL	3.3	A_neutral_B	B_neutral_A	a young girl sitting in swimming gear	a young girl sitting in swimming gear	FLICKR	FLICKR	TEST	A:girl,B:man,
8065	A dog is running on a muddy path	A dog is running on a snowy path	NEUTRAL	3.5	A_neutral_B	B_neutral_A	a dog runs on a snowy path	a dog runs on a snowy path	FLICKR	FLICKR	TRAIN	A:muddy,B:snowy,
8067	A brown dog is running through a snowy trail	A white dog is running through a snowy trail	NEUTRAL	3.4	A_neutral_B	B_neutral_A	a brown dog runs through a snowy trail	a brown dog runs through a snowy trail	FLICKR	FLICKR	TRAIN	A:brown,B:white,
8074	Two children in white outfits and red protective gear are sitting on a mat	Two children in white outfits and red protective gear are sparring on a mat	NEUTRAL	4.2	A_neutral_B	B_neutral_A	two children in white outfits and red protective gear spar on a mat	two children in white outfits and red protective gear spar on a mat	FLICKR	FLICKR	TEST	A:sitting,B:sparring,
8076	Two boys are doing martial arts on a green mat	Two boys are doing martial arts on a blue mat	NEUTRAL	3.9	A_neutral_B	B_contradicts_A	two boys do martial arts on a blue mat	two boys do martial arts on a blue mat	FLICKR	FLICKR	TRAIN	A:green,B:blue,
8085	A black and white dog is playing with a new volleyball	A black and white dog is playing with a broken volleyball	NEUTRAL	3.5	A_neutral_B	B_neutral_A	a black and white dog playing with a broken volleyball	a black and white dog playing with a broken volleyball	FLICKR	FLICKR	TEST	A:new,B:broken,
8092	A young boy in a helmet is riding a bike on the lawn	A young boy in a helmet is riding a bike on the road	NEUTRAL	3.5	A_contradicts_B	B_neutral_A	a young boy in a helmet rides a bike on the road	a young boy in a helmet rides a bike on the road	FLICKR	FLICKR	TRAIN	A:lawn,B:road,
8094	The little boy is riding a bicycle in a race	The little girl is riding a bicycle in a race	NEUTRAL	3.6	A_neutral_B	B_neutral_A	the little boy rides his bicycle in a race	the little boy rides his bicycle in a race	FLICKR	FLICKR	TRAIN	A:boy,B:girl,
8110	Two kids and a man are playing games at an arcade	Two kids and a woman are playing games at an arcade	NEUTRAL	3.7	A_neutral_B	B_neutral_A	two kids and a man play games at an arcade	two kids and a man play games at an arcade	FLICKR	FLICKR	TRAIN	A:man,B:woman,
8119	A female cheerleader is jumping on the knee of a male cheerleader	A female cheerleader is sitting on the knee of a male cheerleader	NEUTRAL	3.58	A_neutral_B	B_contradicts_A	a female cheerleader sits on the knee of a male cheerleader	a female cheerleader sits on the knee of a male cheerleader	FLICKR	FLICKR	TRAIN	A:jumping,B:sitting,
8128	A group of people is holding food and pointing at the camera	A group of people is holding drinks and pointing at the camera	NEUTRAL	3.1	A_neutral_B	B_neutral_A	a group of people hold drinks and point at the camera	a group of people hold drinks and point at the camera	FLICKR	FLICKR	TEST	A:food,B:drinks,
8130	Several young people are posing for a photo and holding beers	Several old people are posing for a photo and holding beers	NEUTRAL	3.265	A_neutral_B	B_neutral_A	several young people posing for this photo holding beers	several young people posing for this photo holding beers	FLICKR	FLICKR	TRAIN	A:young,B:old,
8145	A woman in blue has a yellow ball in the mitt	A woman in blue has a yellow ball in the hand	NEUTRAL	3.8	A_neutral_B	B_neutral_A	a woman in blue has a yellow ball in her mitt	a woman in blue has a yellow ball in her mitt	FLICKR	FLICKR	TRAIN	A:mitt,B:hand,
8146	A woman in blue has a yellow ball in the mitt	A man in blue has a yellow ball in the mitt	NEUTRAL	2.8	A_neutral_B	B_neutral_A	a woman in blue has a yellow ball in her mitt	a woman in blue has a yellow ball in her mitt	FLICKR	FLICKR	TEST	A:woman,B:man,
8148	The girl in blue is chasing the base runner with a number on the jersey	The man in blue is chasing the base runner with a number on the jersey	NEUTRAL	3.3	A_neutral_B	B_neutral_A	girl in blue tries to get a base runner number 11 out during softball game	girl in blue tries to get a base runner number 11 out during softball game	FLICKR	FLICKR	TEST	A:girl,B:man,
8164	Two people are driving a jeep and a lady is sitting on the top of it	Two people are driving a boat and a lady is sitting on the top of it	NEUTRAL	3.415	A_neutral_B	B_neutral_A	two people drive a jeep while a lady sits on the top of it	two people drive a jeep while a lady sits on the top of it	FLICKR	FLICKR	TEST	A:jeep,B:boat,
8166	A blond woman is sitting on the roof of a yellow vehicle and two people are inside	A blond woman is sitting on the roof of a yellow vehicle and two people are outside	NEUTRAL	3.8	A_neutral_B	B_neutral_A	in rural outdoors, blond woman sits on roof of yellow bmw vehicle, two people inside	in rural outdoors, blond woman sits on roof of yellow bmw vehicle, two people inside	FLICKR	FLICKR	TEST	A:inside,B:outside,
8173	A large brown cat is jumping over a red hurdle	A large brown dog is jumping over a red hurdle	NEUTRAL	3.4	A_neutral_B	B_neutral_A	large brown dog jumps over red hurdle	large brown dog jumps over red hurdle	FLICKR	FLICKR	TRAIN	A:cat,B:dog,
8187	The yellow dog is drinking water from a container	A yellow dog is drinking water from the faucet	NEUTRAL	3.9	A_neutral_B	B_neutral_A	yellow labrador drinking water from a faucet	the yellow dog is drinking water from a bottle	FLICKR	FLICKR	TRAIN	A:container,B:faucet,
8188	A yellow dog is drinking water from the faucet	The yellow dog is drinking water from a pot	NEUTRAL	3.3	A_neutral_B	B_neutral_A	yellow labrador drinking water from a faucet	the yellow dog is drinking water from a bottle	FLICKR	FLICKR	TEST	A:faucet,B:pot,
8199	A bride with a white dress is looking down	A bride with a white veil is looking down	NEUTRAL	4.435	A_neutral_B	B_neutral_A	bride with a white veil looking down	bride with a white veil looking down	FLICKR	FLICKR	TRAIN	A:dress,B:veil,
8200	A bride with a black veil is looking down	A bride with a white veil is looking down	NEUTRAL	3.5	A_neutral_B	B_neutral_A	bride with a white veil looking down	bride with a white veil looking down	FLICKR	FLICKR	TRAIN	A:black,B:white,
8202	A woman is looking down and is wearing a wedding veil	A boy is looking down and wearing a wedding veil	NEUTRAL	2.9	A_neutral_B	B_neutral_A	a woman is looking down and wearing a white hair piece that looks like a wedding veil	a woman is looking down and wearing a white hair piece that looks like a wedding veil	FLICKR	FLICKR	TEST	A:woman,B:boy,
8227	A white dog is running across a rocky landscape	A black dog is running across a rocky landscape	NEUTRAL	3.7	A_neutral_B	B_contradicts_A	a black dog is running across a rocky landscape	a black dog is running across a rocky landscape	FLICKR	FLICKR	TRAIN	A:white,B:black,
8229	A black dog is walking along rocky terrain	A black cat is walking along rocky terrain	NEUTRAL	3.6	A_contradicts_B	B_neutral_A	a black dog walking along a rocky terrain	a black dog walking along a rocky terrain	FLICKR	FLICKR	TEST	A:dog,B:cat,
8238	Three dogs are resting on a couch	Three dogs are resting on a sidewalk	NEUTRAL	3	A_neutral_B	B_neutral_A	three dogs on a sidewalk	three dogs on a sidewalk	FLICKR	FLICKR	TEST	A:couch,B:sidewalk,
8245	A young man is pushing a motocross bike up a dirt hill	A young man is pushing a motocross bike down a dirt hill	NEUTRAL	3.4	A_neutral_B	B_neutral_A	a young man pushes his motocross bike up a dirt hill	a young man pushes his motocross bike up a dirt hill	FLICKR	FLICKR	TEST	A:up,B:down,
8247	Some young dirt bikers are getting a dirt bike up a sandy hill	Some old dirt bikers are getting a dirt bike up a sandy hill	NEUTRAL	4	A_contradicts_B	B_neutral_A	young dirt bikers try to get a dirt bike up a sandy hill	young dirt bikers try to get a dirt bike up a sandy hill	FLICKR	FLICKR	TRAIN	A:young,B:old,
8254	A middle aged man and woman are riding bikes down a road beside the water	A middle aged man and woman are riding horses down a road beside the water	NEUTRAL	3.8	A_neutral_B	B_neutral_A	a middle aged man and woman ride bikes down a road beside the water	a middle aged man and woman ride bikes down a road beside the water	FLICKR	FLICKR	TEST	A:bikes,B:horses,
8256	A young man and a woman are riding bikes on the boardwalk near the ocean	An older man and a woman are riding bikes on the boardwalk near the ocean	NEUTRAL	3.5	A_neutral_B	B_neutral_A	an older man and woman ride bikes on the boardwalk near the ocean	an older man and woman ride bikes on the boardwalk near the ocean	FLICKR	FLICKR	TEST	A:young,B:older,
8265	Pedestrians and cars are moving through a traffic jam in a small city	Pedestrians and cars are moving through a traffic jam in a big city	NEUTRAL	4	A_neutral_B	B_neutral_A	pedestrians and cars make their way through times square in new york	pedestrians and cars make their way through times square in new york	FLICKR	FLICKR	TEST	A:small,B:big,
8274	Two dogs are playing inside	Two dogs are playing outside	NEUTRAL	3.7	A_contradicts_B	B_neutral_A	a collie and a springer spaniel playing outside	a collie and a springer spaniel playing outside	FLICKR	FLICKR	TRAIN	A:inside,B:outside,
8281	A soccer player is sitting on the field and is drinking water	A soccer player is sitting on the field and is drinking beer	NEUTRAL	2.9	A_neutral_B	B_neutral_A	a soccer player sits on the field drinking water	a soccer player sits on the field drinking water	FLICKR	FLICKR	TRAIN	A:water,B:beer,
8283	A man is sitting on the grass and drinking from a water bottle	A woman is sitting on the grass and is drinking from a water bottle	NEUTRAL	4	A_neutral_B	B_neutral_A	a man sits on the grass and drinks from a water bottle	a man sits on the grass and drinks from a water bottle	FLICKR	FLICKR	TRAIN	A:man,B:woman,
8299	A boy is wearing sunglasses	A girl is wearing sunglasses	NEUTRAL	3.3	A_neutral_B	B_neutral_A	a boy wears sunglasses	a boy wears sunglasses	FLICKR	FLICKR	TEST	A:boy,B:girl,
8310	A young boy with painted face is standing next to some other children	A young girl with painted face is standing next to some other children	NEUTRAL	3.3	A_neutral_B	B_neutral_A	a young girl with her face painted stands next to some other children	a young girl with her face painted stands next to some other children	FLICKR	FLICKR	TEST	A:boy,B:girl,
8335	A man is doing a trick on a skateboard	A man is doing a trick on a bike	NEUTRAL	2.5	A_neutral_B	B_neutral_A	a man doing a trick on a skateboard	a man doing a trick on a skateboard	FLICKR	FLICKR	TRAIN	A:skateboard,B:bike,
8337	A woman is doing a skateboard trick on an outdoor park porch	A man is doing a skateboard trick on an outdoor park porch	NEUTRAL	3.9	A_neutral_B	B_neutral_A	man doing a skateboard trick on an outdoor park porch	man doing a skateboard trick on an outdoor park porch	FLICKR	FLICKR	TEST	A:woman,B:man,
8353	People are sitting at round tables in a red room	People are sitting at square tables in a red room	NEUTRAL	3.9	A_contradicts_B	B_neutral_A	people are sitting at square tables in a red room	people are sitting at square tables in a red room	FLICKR	FLICKR	TEST	A:round,B:square,
8355	Several people are sitting at small tables in a light room	Several people are sitting at small tables in a darkened room	NEUTRAL	3.9	A_contradicts_B	B_neutral_A	several people sitting at small tables in a darkened room	several people sitting at small tables in a darkened room	FLICKR	FLICKR	TRAIN	A:light,B:darkened,
8361	A boy in a striped shirt is playing in front of a water fountain	A boy in a striped shirt is jumping in front of a water fountain	NEUTRAL	4.4	A_neutral_B	B_neutral_A	a boy in s striped shirt is jumping in front of a water fountain	a boy in s striped shirt is jumping in front of a water fountain	FLICKR	FLICKR	TEST	A:playing,B:jumping,
8382	The young girl in blue is having fun on a swing	The young girl in blue is having fun on a slide	NEUTRAL	3.8	A_contradicts_B	B_neutral_A	the young girl in blue is having fun on a slide	the young girl in blue is having fun on a slide	FLICKR	FLICKR	TEST	A:swing,B:slide,
8389	A white man is walking next to a building in a big city	A black man is walking next to a building in a big city	NEUTRAL	3.3	A_neutral_B	B_neutral_A	a black man is walking next to a building in a big city	a black man is walking next to a building in a big city	FLICKR	FLICKR	TRIAL	A:white,B:black,
8409	A black dog is jumping from a dock into the water	A white dog is jumping from a dock into the water	NEUTRAL	3.8	A_neutral_B	B_neutral_A	a black dog jumping from a dock into water	a black dog jumping from a dock into water	FLICKR	FLICKR	TRAIN	A:black,B:white,
8416	A girl in a white dress is running	A girl in a white dress is standing	NEUTRAL	3.5	A_neutral_B	B_neutral_A	a girl in a white dress running	a girl in a white dress running	FLICKR	FLICKR	TEST	A:running,B:standing,
8425	A skier in white is catching a tiny bit of air	A skier in black is catching a tiny bit of air	NEUTRAL	4	A_neutral_B	B_neutral_A	a downhill skier in black catches a tiny bit of air	a downhill skier in black catches a tiny bit of air	FLICKR	FLICKR	TRAIN	A:white,B:black,
8426	A man is skiing down a snowy mountain	A man is skiing down a snowy hill	NEUTRAL	4.1	A_neutral_B	B_neutral_A	a man skis down a snowy hill	a man skis down a snowy hill	FLICKR	FLICKR	TRAIN	A:mountain,B:hill,
8443	Two women are standing together and one is looking through binoculars	Two men are standing together and one is looking through binoculars	NEUTRAL	3.7	A_neutral_B	B_neutral_A	two men are standing together while one looks through binoculars	two men are standing together while one looks through binoculars	FLICKR	FLICKR	TEST	A:women,B:men,
8445	Two men are looking out and one is holding binoculars	Two men are looking out and one is holding a spyglass	NEUTRAL	4	A_neutral_B	B_neutral_A	two men look out as one is holding binoculars	two men look out as one is holding binoculars	FLICKR	FLICKR	TEST	A:binoculars,B:spyglass,
8454	A man on a motorcycle is going around a corner	A woman on a motorcycle is going around a corner	NEUTRAL	3.6	A_neutral_B	B_neutral_A	a man on a motorcycle going around a corner	a man on a motorcycle going around a corner	FLICKR	FLICKR	TEST	A:man,B:woman,
8461	A man with no hat is sitting on the ground	A man with a backwards hat is sitting on the ground	NEUTRAL	4	A_neutral_B	B_contradicts_A	a man with a backwards hat sits on the ground	a man with a backwards hat sits on the ground	FLICKR	FLICKR	TRIAL	A:no,B:backwards,
8463	An old man in a white shirt and gold and black hat is sitting with crossed legs	A young man in a white shirt and gold and black hat is sitting with crossed legs	NEUTRAL	3.5	A_contradicts_B	B_neutral_A	a young man in a white shirt and gold and black hat sits cross legged	a young man in a white shirt and gold and black hat sits cross legged	FLICKR	FLICKR	TEST	A:old,B:young,
8470	A young occidental girl is standing above the crowd and is playing with a pinwheel	A young oriental girl is standing above the crowd and is playing with a pinwheel	NEUTRAL	4.2	A_neutral_B	B_neutral_A	a young oriential girl is standing above the crowd playing with a pinwheel	a young oriential girl is standing above the crowd playing with a pinwheel	FLICKR	FLICKR	TRAIN	A:occidental,B:oriental,
8472	A girl in blue sweater is holding a multicolor toy and is sitting on the shoulders of a man with grey hair	A girl in blue sweater is holding a multicolor toy and is sitting on the shoulders of a woman with grey hair	NEUTRAL	4.085	A_neutral_B	B_contradicts_A	girl in blue sweater and holding a multicolor toy sitting on the shoulders of a man with grey hair	girl in blue sweater and holding a multicolor toy sitting on the shoulders of a man with grey hair	FLICKR	FLICKR	TEST	A:man,B:woman,
8487	A shirtless man is playing football on a lawn	A shirtless man is playing football on a field	NEUTRAL	4.1	A_neutral_B	B_neutral_A	a shirtless man playing football on a lawn	a shirtless man playing football on a lawn	FLICKR	FLICKR	TEST	A:lawn,B:field,
8490	A man with a shirt is holding a football	A man with no shirt is holding a football	NEUTRAL	3.3	A_neutral_B	B_neutral_A	a man with no shirt on is holding a football	a man with no shirt on is holding a football	FLICKR	FLICKR	TRAIN	B:no,
8505	Two people are sitting on a park bench on a sunny day	Two people are sitting on a park bench on a hot day	NEUTRAL	4.3	A_neutral_B	B_neutral_A	two people sitting on a park bench on a sunny day	two people sitting on a park bench on a sunny day	FLICKR	FLICKR	TRIAL	A:sunny,B:hot,
8506	Two people are sitting on a park bench on a sunny day	Two people are sitting on a park bench on a rainy day	NEUTRAL	3.2	A_neutral_B	B_contradicts_A	two people sitting on a park bench on a sunny day	two people sitting on a park bench on a sunny day	FLICKR	FLICKR	TRAIN	A:sunny,B:rainy,
8507	Two women dressed in white and black are relaxing on a bench	Two women dressed in white and black are sitting on a bench	NEUTRAL	4.2	A_neutral_B	B_neutral_A	two women, one in white, one in black, are sitting on a bench	two women, one in white, one in black, are sitting on a bench	FLICKR	FLICKR	TRAIN	A:relaxing,B:sitting,
8508	Two women dressed in white and black are sitting on a bench	Two men dressed in white and black are sitting on a bench	NEUTRAL	3.6	A_neutral_B	B_neutral_A	two women, one in white, one in black, are sitting on a bench	two women, one in white, one in black, are sitting on a bench	FLICKR	FLICKR	TEST	A:women,B:men,
8517	Five people are running with three dogs in the green field beside the road	Five people are standing with three dogs in the green field beside the road	NEUTRAL	3.5	A_neutral_B	B_neutral_A	five people are standing with three dogs in the green field beside the road	five people are standing with three dogs in the green field beside the road	FLICKR	FLICKR	TRAIN	A:running,B:standing,
8524	An old woman is carrying a lot of colorful scarves on the beach	A young woman is carrying a lot of colorful scarves on the beach	NEUTRAL	4.2	A_neutral_B	B_neutral_A	a young woman carries a lot of colorful scarves on the beach	a young woman carries a lot of colorful scarves on the beach	FLICKR	FLICKR	TRAIN	A:old,B:young,
8526	A girl in gold and purple is holding a rainbow afghan	A man in gold and purple is holding a rainbow afghan	NEUTRAL	3.8	A_neutral_B	B_neutral_A	a girl in gold and purple is holding a rainbow afghan	a girl in gold and purple is holding a rainbow afghan	FLICKR	FLICKR	TEST	A:girl,B:man,
8533	A light brown dog is running in the grass	A light brown dog is running in the water	NEUTRAL	4	A_neutral_B	B_neutral_A	a light brown dog is running in the water	a light brown dog is running in the water	FLICKR	FLICKR	TEST	A:grass,B:water,
8534	A tan dog is splashing in the water on the bank of a pond	A tan dog is playing in the water on the bank of a pond	NEUTRAL	4.2	A_neutral_B	B_neutral_A	a tan dog splashing in water on the bank of a pond or river	a tan dog splashing in water on the bank of a pond or river	FLICKR	FLICKR	TEST	A:splashing,B:playing,
8535	A tan dog is splashing in the water on the bank of a pond	A tan dog is splashing in the water on the bank of a river	NEUTRAL	4.3	A_neutral_B	B_neutral_A	a tan dog splashing in water on the bank of a pond or river	a tan dog splashing in water on the bank of a pond or river	FLICKR	FLICKR	TEST	A:pond,B:river,
8577	A dog is playing on the ground	A dog is rolling on the ground	NEUTRAL	4.2	A_neutral_B	B_neutral_A	a dog rolls on the ground	a dog rolls on the ground	FLICKR	FLICKR	TEST	A:playing,B:rolling,
8578	A dog is rolling on the ground	A dog is sleeping on the ground	NEUTRAL	3.8	A_neutral_B	B_neutral_A	a dog rolls on the ground	a dog rolls on the ground	FLICKR	FLICKR	TRAIN	A:rolling,B:sleeping,
8580	A dirty tan dog is rolling in the water and looking right at the camera	A dirty tan dog is rolling in the dirt and looking right at the camera	NEUTRAL	3.8	A_neutral_B	B_neutral_A	a dirty tan dog rolling in the dirt and looking right at the camera	a dirty tan dog rolling in the dirt and looking right at the camera	FLICKR	FLICKR	TEST	A:water,B:dirt,
8589	A man with a white hat and brown shirt is behind a woman in red and is looking to the right	A man with a white hat and brown shirt is behind a woman in red and is looking to the left	NEUTRAL	4.3	A_neutral_B	B_contradicts_A	a man with a white hat and brown shirt, behind a woman in red, looks to the left	a man with a white hat and brown shirt, behind a woman in red, looks to the left	FLICKR	FLICKR	TRAIN	A:right,B:left,
8596	Little kids are playing in a water fountain in front of lots of people	Little kids are playing in a water fountain in front of few people	NEUTRAL	4.1	A_neutral_B	B_contradicts_A	little kids are playing in a water fountain in front of lots of people	little kids are playing in a water fountain in front of lots of people	FLICKR	FLICKR	TRAIN	A:lots,B:few,
8605	A person on a yellow dirt bike is taking a jump	A person on a yellow clean bike is taking a jump	NEUTRAL	3.6	A_neutral_B	B_neutral_A	a person on a yellow dirt bike is taking a jump	a person on a yellow dirt bike is taking a jump	FLICKR	FLICKR	TEST	A:dirt,B:clean,
8614	A man is wearing a beret and is riding the bicycle on a recreation trail	A woman is wearing a beret and is riding the bicycle on a recreation trail	NEUTRAL	3.4	A_neutral_B	B_neutral_A	a man wearing a beret rides his bicycle on a recreation trail	a man wearing a beret rides his bicycle on a recreation trail	FLICKR	FLICKR	TRAIN	A:man,B:woman,
8634	A man is rock climbing, pausing and calculating the route	A woman is rock climbing, pausing and calculating the route	NEUTRAL	4.2	A_contradicts_B	B_neutral_A	a man rock climbing pauses to calculate his route	a man rock climbing pauses to calculate his route	FLICKR	FLICKR	TEST	A:man,B:woman,
8641	A little girl in a pink shirt is playing t-ball and taking a swing	A little boy in a pink shirt is playing t-ball and taking a swing	NEUTRAL	3.4	A_neutral_B	B_neutral_A	a little girl in a pink shirt takes a swing at a t-ball	a little girl in a pink shirt takes a swing at a t-ball	FLICKR	FLICKR	TEST	A:girl,B:boy,
8644	A girl is hitting a little tee with a baseball	A little girl is hitting a baseball off a tee	NEUTRAL	3.9	A_neutral_B	B_neutral_A	a little girl about to hit a baseball off a tee	a little girl about to hit a baseball off a tee	FLICKR	FLICKR	TEST	A:with,B:off,
8653	The people are standing at a carnival	The people are standing at a parade	NEUTRAL	3.2	A_neutral_B	B_neutral_A	the people are standing around at a carnival	the people are standing around at a carnival	FLICKR	FLICKR	TEST	A:carnival,B:parade,
8654	The people are standing at a carnival	The people are running at a carnival	NEUTRAL	4.1	A_neutral_B	B_contradicts_A	the people are standing around at a carnival	the people are standing around at a carnival	FLICKR	FLICKR	TEST	A:standing,B:running,
8662	Rollerbladers are rolling in formation down a hill	Rollerbladers are running in formation down a hill	NEUTRAL	4.2	A_neutral_B	B_neutral_A	rollerbladers roll in formation down a hill	rollerbladers roll in formation down a hill	FLICKR	FLICKR	TEST	A:rolling,B:running,
8670	A woman is standing with a pair of dogs	A woman is marching with a pair of dogs	NEUTRAL	4.1	A_contradicts_B	B_neutral_A	a woman marches with a pair of dogs	a woman marches with a pair of dogs	FLICKR	FLICKR	TEST	A:standing,B:marching,
8681	A man dressed in black is wearing inline skates and performing a trick on a rail	A woman dressed in black is wearing inline skates and performing a trick on a rail	NEUTRAL	3	A_neutral_B	B_neutral_A	a man dressed all in black performs a trick on a rail while wearing inline skates	a man dressed all in black performs a trick on a rail while wearing inline skates	FLICKR	FLICKR	TEST	A:man,B:woman,
8690	Three children are running up a grassy hillside	Three children are running down a grassy hillside	NEUTRAL	4.3	A_neutral_B	B_contradicts_A	three children running down a grassy hillside	three children running down a grassy hillside	FLICKR	FLICKR	TRAIN	A:up,B:down,
8699	A white bird with a yellow beak is standing in the green grass	A black bird with a yellow beak is standing in the green grass	NEUTRAL	3.8	A_contradicts_B	B_neutral_A	a black bird with a yellow beak standing in green grass	a black bird with a yellow beak standing in green grass	FLICKR	FLICKR	TRAIN	A:white,B:black,
8706	A shirtless man is posing with a girl who is hiking in a park	A shirtless woman is posing with a girl who is hiking in a park	NEUTRAL	3.4	A_neutral_B	B_neutral_A	a shirtless man poses with a girl hiking in a park	a shirtless man poses with a girl hiking in a park	FLICKR	FLICKR	TEST	A:man,B:woman,
8708	A man with a shirt is posing with the arms spread next to a woman	A man without a shirt is posing with the arms spread next to a woman	NEUTRAL	4.2	A_contradicts_B	B_neutral_A	a man without a shirt poses with his arms spread next to a woman	a man without a shirt poses with his arms spread next to a woman	FLICKR	FLICKR	TRAIN	B:without,
