7246;A woman is speaking loudly on her cell phone and is keeping a purse and a yellow bag on the near ledge;A woman is speaking on her cell phone and is keeping a purse and a yellow bag on the near ledge;A_entails_B;B_neutral_A;correct: A entails B;;;
7257;A man on a bicycle is riding on one wheel only;A person on a bike is riding on one wheel only;A_entails_B;B_neutral_A;correct: A entails B;;;
7260;The man is doing a wheelie on a mountain bike;A person on a bike is riding on one wheel only;A_entails_B;B_neutral_A;correct: A entails B;;;
7263;One man is doing a wheelie on the mountain bike;A man on a bicycle is riding on one wheel only;A_entails_B;B_neutral_A;correct: A entails B;;;
7265;The man is doing a wheelie on a mountain bike;A man on a bicycle is riding on one wheel only;A_entails_B;B_neutral_A;correct: A entails B;;;
7268;A bird is fiercely flapping its wings on the water;A bird is flapping its wings on the water;A_entails_B;B_neutral_A;correct: A entails B;;;
7272;A duck with brown feathers and a green head is flapping its wings in the water;A bird is flapping its wings on the water;A_entails_B;B_neutral_A;correct: A entails B;;;
7274;A brown duck with a green head is flapping its wings in the water;A bird is flapping its wings on the water;A_entails_B;B_neutral_A;correct: A entails B;;;
7279;A furry brown dog is running through the grassy area;The brown dog is playing outdoors;A_entails_B;B_neutral_A;correct: A entails B;;;
7286;The elderly lady is anxiously waiting on the sidewalk;The elderly lady is waiting on the sidewalk;A_entails_B;B_neutral_A;correct: A entails B;;;
7301;A young child is running down a road made of gravel that is covered with dead leaves;A young child is running outside over the fallen leaves;A_entails_B;B_neutral_A;correct: A entails B;;;
7303;A young child is running down a gravel road that is covered with dead leaves;A young child is running outside over the fallen leaves;A_entails_B;B_neutral_A;correct: A entails B;;;
7307;A man is wearing a straw hat and smoking a cigarette;A person is wearing a straw hat and smoking a cigarette;A_entails_B;B_neutral_A;correct: A entails B;;;
7309;The man in the straw hat is smoking a cigarette;A person is wearing a straw hat and smoking a cigarette;A_entails_B;B_neutral_A;correct: A entails B;;;
7315;A man is wearing a blue checkered shirt and cheerfully riding a unicycle in the street;A man is wearing a blue checkered shirt and riding a unicycle in the street;A_entails_B;B_neutral_A;correct: A entails B;;;
7324;Three men are staring at the big green hills in the distance;Some men are staring at the big green hills in the distance;A_entails_B;B_neutral_A;correct: A entails B;;;
7327;Three men are looking absent mindedly into the distance;Three men are looking into the distance;A_entails_B;B_neutral_A;correct: A entails B;;;
7334;Three men are staring at the big green hills in the distance;Three men are looking into the distance;A_entails_B;B_neutral_A;correct: A entails B;;;
7335;A mountain is being climbed by two men;The men are climbing a mountain;A_entails_B;B_neutral_A;correct: A entails B;;;
7346;Two children are playing on a statue;Some children are playing on a statue;A_entails_B;B_neutral_A;correct: A entails B;;;
7351;Two children are playing on a statue;Small kids are climbing a statue in a park;A_entails_B;B_neutral_A;wrong: A should be neutral to B;playing !=> climbing;;
7354;Small children are climbing a statue in a park;Some children are playing on a statue;A_entails_B;B_neutral_A;correct: A entails B;;;
7385;A smiling boy in winter clothes is waving his mittened hands outside a building in the snow;A young child dressed for cold weather is standing outside;A_entails_B;B_neutral_A;correct: A entails B;;;
7388;A child is playfully swimming underwater in a pool;A child is swimming underwater in a pool;A_entails_B;B_neutral_A;correct: A entails B;;;
7424;A red dog is excitedly jumping up and catching a tennis ball in its mouth;A red dog is jumping and catching a tennis ball in its mouth;A_entails_B;B_neutral_A;correct: A entails B;;;
7455;A man is performing a trick on a surfboard in the water;A person is performing a trick on a surfboard in the water;A_entails_B;B_neutral_A;correct: A entails B;;;
7471;A man and two women in a dark room are sitting at a table with candles;The group of people is sitting in a dim room;A_entails_B;B_neutral_A;correct: A entails B;;;
7473;A man and two women in a darkened room are sitting at a table with candles;The group of people is sitting in a room which is dim;A_entails_B;B_neutral_A;correct: A entails B;;;
7476;A man and two women in a darkened room are sitting at a table with candles;The group of people is sitting in a dim room;A_entails_B;B_neutral_A;correct: A entails B;;;
7495;A person is wearing a red jacket and carefully holding a beer;A person is wearing a red jacket and holding a beer;A_entails_B;B_neutral_A;correct: A entails B;;;
7510;Two dogs are battling for a frisbee in a lake;Two brown dogs are playing with a frisbee in the water;A_entails_B;B_neutral_A;correct: A entails B;;;
7538;A football player in a purple jersey is breathlessly running with the ball for a touchdown;A football player in a purple jersey is running with the ball for a touchdown;A_entails_B;B_neutral_A;correct: A entails B;;;
7550;A young girl in a blue leotard is jumping in the air;The young girl in blue is jumping in the air;A_entails_B;B_neutral_A;correct: A entails B;;;
7552;A young girl in a leotard colored in blue is jumping in the air;A young girl in blue is jumping in the air;A_entails_B;B_neutral_A;correct: A entails B;;;
7554;A young girl in a blue leotard is jumping in the air;A young girl in blue is jumping in the air;A_entails_B;B_neutral_A;correct: A entails B;;;
7568;A person on a bike is jumping through the air and the sun is flaring beautifully through the bike frame;A person on a bike is jumping through the air and the sun is flaring through the bike frame;A_entails_B;B_neutral_A;correct: A entails B;;;
7570;A person on a bike is jumping through the air and the sun is flaring beautifully through the bike frame;The person is flying through the air on a bicycle;A_entails_B;B_neutral_A;correct: A entails B;;;
7572;A person on a bike is jumping through the air and the sun is flaring through the bike frame;The person is flying through the air on the bicycle;A_entails_B;B_neutral_A;correct: A entails B;;;
7574;A person on a bike is jumping through the air and the sun is flaring through the bike frame;The person is flying through the air on a bicycle;A_entails_B;B_neutral_A;correct: A entails B;;;
7580;The bunch of men are playing rugby on a muddy field;Rugby is being played by some men;A_entails_B;B_neutral_A;correct: A entails B;;;
7582;The bunch of men are playing rugby on a field full of mud;Some men are playing rugby;A_entails_B;B_neutral_A;correct: A entails B;;;
7585;The bunch of men are playing rugby on a muddy field;Some men are playing rugby;A_entails_B;B_neutral_A;correct: A entails B;;;
7597;It is snowing on two playing dogs;Two dogs are playing in the snow;A_entails_B;B_neutral_A;correct: A entails B;;;
7600;The brown dog and the gray dog are playing in the snow;Two dogs are playing in the snow;A_entails_B;B_neutral_A;correct: A entails B;;;
7605;A brown dog and a gray dog are playing in the snow;Two dogs are playing in the snow;A_entails_B;B_neutral_A;correct: A entails B;;;
7606;A young woman is getting a tattoo on her hand;A girl is getting a tattoo on her hand;A_entails_B;B_neutral_A;correct: A entails B;;;
7618;A girl dressed in purple and blue is slowly walking beside her bike at night;A girl dressed in purple and blue is walking beside her bike at night;A_entails_B;B_neutral_A;correct: A entails B;;;
7639;A tree is falling over a bridge made over the river which a dog is crossing;A dog is crossing a river on a bridge made from a fallen tree;A_entails_B;B_neutral_A;wrong: A should be neutral to B;different sentences;;
7640;The black dog is walking along a tree trunk bridge over water;A river is being crossed by a dog on a bridge made from a fallen tree;A_entails_B;B_neutral_A;correct: A entails B;;;
7642;The black dog is walking along a tree trunk bridge over water;A tree is falling over a bridge made over the river which a dog is crossing;A_entails_B;B_neutral_A;wrong: A should be neutral to B;tree is falling over a bridge !=> tree trunk bridge;;
7648;A little boy is proudly wearing a green soccer strip and is running on the grass;A little boy is wearing a green soccer strip and is running on the grass;A_entails_B;B_neutral_A;correct: A entails B;;;
7650;A little boy is proudly wearing a green soccer strip and is running on the grass;A child in a green and white sports uniform is running over the grass;A_entails_B;B_neutral_A;correct: A entails B;;;
7658;A young lady in a bikini is lying on the beach;A lady who looks young is lying on the beach;A_entails_B;B_neutral_A;correct: A entails B;;;
7670;The man is doing a handstand on the wet sand at the edge of the water at the beach;A handstand is being performed by a man on the beach;A_entails_B;B_neutral_A;correct: A entails B;;;
7672;The man is doing a handstand on the wet shore at the edge of the water at the beach;A man is performing a handstand on the beach;A_entails_B;B_neutral_A;correct: A entails B;;;
7677;A young mother is playing with her boy in the park;A young boy is playing in the park with his mother;A_entails_B;B_neutral_A;correct: A entails B;;;
7688;A young boy is quickly jumping off a chair;A young boy is jumping off a chair;A_entails_B;B_neutral_A;correct: A entails B;;;
7690;A little boy with brown hair is jumping off of a brown chair onto the floor;A young boy is quickly jumping off a chair;A_entails_B;B_neutral_A;wrong: A should be neutral to B;jumping off !=> quickly jumping off;;
7692;One little boy with brown hair is jumping off of the brown chair onto the floor;A young boy is jumping off a chair;A_entails_B;B_neutral_A;correct: A entails B;;;
7694;A little boy with brown hair is jumping off of a brown chair onto the floor;A young boy is jumping off a chair;A_entails_B;B_neutral_A;correct: A entails B;;;
7712;The blonde girl with the pink top is smiling and wearing funny glasses with a large nose attached;The little girl is smiling and wearing a fake nose and glasses;A_entails_B;B_neutral_A;wrong: A should be neutral to B;little !=> blonde;;
7714;The blonde girl with the pink top is smiling and wearing funny glasses with a large nose attached;A little girl is smiling and wearing a fake nose and glasses;A_entails_B;B_neutral_A;wrong: A should be neutral to B;little !=> blonde;;
7727;A child is amazedly experiencing a new world;A child is experiencing a new world;A_entails_B;B_neutral_A;correct: A entails B;;;
7737;A dog is playing alone on a beach covered by snow;A dog is playing alone on the shore covered by snow;A_entails_B;B_neutral_A;correct: A entails B;;;
7771;A surfer is riding a big wave across dark green water;A surfer is riding a big wave;A_entails_B;B_neutral_A;correct: A entails B;;;
7774;A big wave is being ridden by a surfer across dark green water;The surfer is riding a big wave;A_entails_B;B_neutral_A;correct: A entails B;;;
7776;A surfer is riding a big wave across dark green water;The surfer is riding a big wave;A_entails_B;B_neutral_A;correct: A entails B;;;
7777;The shirtless man in striped shorts and sunglasses is standing near a man in a white shirt and sunglasses;The shirtless man in striped shorts and sunglasses is standing near a person in a white shirt and sunglasses;A_entails_B;B_neutral_A;correct: A entails B;;;
7779;The muscular black man is dancing and the man behind him is wearing green beads;The muscular man is dancing and the man behind him is wearing green beads;A_entails_B;B_neutral_A;correct: A entails B;;;
7786;A person wearing grey pants is airborne on a snowboard;A person is wearing grey pants on a snowboard;A_entails_B;B_neutral_A;correct: A entails B;;;
7788;A snowboarding man is jumping through the air;A snowboarder is jumping through the air;A_entails_B;B_neutral_A;correct: A entails B;;;
7804;A man is crouching and holding a camera;A person is crouching and holding a camera;A_entails_B;B_neutral_A;correct: A entails B;;;
7808;A man is squatting in brush and taking a photo;A man is crouching and holding a camera;A_entails_B;B_neutral_A;wrong: A should be neutral to B;taking a photograph !=> holding a camera;;
7810;A man is squatting in brush and taking a photograph;A person is crouching and holding a camera;A_entails_B;B_neutral_A;wrong: A should be neutral to B;taking a photograph !=> holding a camera;;
7812;A man is squatting in brush and taking a photograph;A man is crouching and holding a camera;A_entails_B;B_neutral_A;wrong: A should be neutral to B;taking a photograph !=> holding a camera;;
7813;Some dogs are playing in a river;Some dogs are playing in a stream;A_entails_B;B_neutral_A;correct: A entails B;;;
7831;The brown dog is jumping in the air;The brown animal is jumping in the air;A_entails_B;B_neutral_A;correct: A entails B;;;
7833;A brown dog is jumping in the air;A dog is jumping in the air;A_entails_B;B_neutral_A;correct: A entails B;;;
7835;The brown dog is jumping in the air;A dog is jumping in the air;A_entails_B;B_neutral_A;correct: A entails B;;;
7837;A brown dog is jumping in the air;The brown animal is jumping in the air;A_entails_B;B_neutral_A;correct: A entails B;;;
7840;A man on a motorcycle is riding on a track and waving happily;A man on a motorcycle is riding on a track and waving;A_entails_B;B_neutral_A;correct: A entails B;;;
7842;The person on the motorcycle is holding up his arm;The person on the motorcycle is holding up an arm;A_entails_B;B_neutral_A;correct: A entails B;;;
7849;Two adults are standing on a scooter in a field of yellow flowers;Two adults are standing on a scooter in a field of flowers;A_entails_B;B_neutral_A;correct: A entails B;;;
7858;A man is riding a dirt bike down a dirt hill;A person is riding a dirt bike down a dirt hill;A_entails_B;B_neutral_A;correct: A entails B;;;
7860;A person is riding a bike along a muddy trail;A person is riding a bike along the trail;A_entails_B;B_neutral_A;correct: A entails B;;;
7867;A man in blue is riding a horse on a dirt road;A man in blue is riding a animal on a dirt road;A_entails_B;B_neutral_A;correct: A entails B;;;
7880;Three people are driving four wheel ATVs in a field;Three people are driving four wheel vehicles in a field;A_entails_B;B_neutral_A;correct: A entails B;;;
7882;Three people are driving ATVs;Three people are driving four wheel vehicles in a field;A_entails_B;B_neutral_A;correct: A entails B;;;
7883;Three people are driving four wheel ATVs in a street;Three people are driving ATVs;A_entails_B;B_neutral_A;correct: A entails B;;;
7884;Three people are driving four wheel ATVs in a field;ATVs are being driven by three people;A_entails_B;B_neutral_A;correct: A entails B;;;
7886;Three people are driving four wheel ATVs in a field;Three people are driving ATVs;A_entails_B;B_neutral_A;correct: A entails B;;;
7887;Two white dogs and one brown dog are chasing a ball;Two white dogs and one brown dog are chasing a toy;A_entails_B;B_neutral_A;correct: A entails B;;;
7889;Two white dogs are playing with a brown dog and a tennis ball;Two white dogs are playing with a brown dog and a ball;A_entails_B;B_neutral_A;correct: A entails B;;;
7893;Two white dogs are playing with a brown dog and a ball;Two white dogs and one brown dog are chasing a toy;A_entails_B;B_neutral_A;correct: A entails B;;;
7902;A white rally car is throwing mud into the air and is approaching a bend in the track;A white racing vehicle is driving through a puddle;A_entails_B;B_neutral_A;correct: A entails B;;;
7905;A dog is jumping at a shiny blue soccer ball in a field of dry leaves;An animal is jumping at a shiny blue soccer ball in a field of dry leaves;A_entails_B;B_neutral_A;correct: A entails B;;;
7916;A dog is running towards a ball;A dog is running towards a toy;A_entails_B;B_neutral_A;correct: A entails B;;;
7918;A dog is running through a field and is chasing a ball;A dog is running through a field and is chasing a toy;A_entails_B;B_neutral_A;correct: A entails B;;;
7922;A dog is running through a field and is chasing a ball;A dog is running towards a toy;A_entails_B;B_neutral_A;correct: A entails B;;;
7924;A dog is running through a field and is chasing a ball;A dog is running towards a ball;A_entails_B;B_neutral_A;correct: A entails B;;;
7925;Four athletes are with a man in a crowded stadium;Four athletes are with a person in a crowded stadium;A_entails_B;B_neutral_A;correct: A entails B;;;
7927;A person in a pink jacket is running onto the field;A person in pink is running onto the field;A_entails_B;B_neutral_A;correct: A entails B;;;
7943;A boy is running through the sea at the beach;A boy is running through the water at the beach;A_entails_B;B_neutral_A;correct: A entails B;;;
7945;A boy in a white t-shirt is splashing in shallow water;A kid in a white t-shirt is splashing in shallow water;A_entails_B;B_neutral_A;correct: A entails B;;;
7952;Two tall basketball players are scrambling for the ball on the court;Two basketball players are scrambling for the ball on the court;A_entails_B;B_neutral_A;correct: A entails B;;;
7960;A basketball player is on the court floor and another one is grabbing the ball;Two basketball players are scrambling for the ball on the court;A_entails_B;B_neutral_A;correct: A entails B;;;
7961;The white dogs are looking curiously at the black llama;The white dogs are looking at the black llama;A_entails_B;B_neutral_A;correct: A entails B;;;
7972;Two poodles are in the snow and one is jumping high;Two poodles are in the snow and one is jumping;A_entails_B;B_neutral_A;correct: A entails B;;;
7974;A grey dog is jumping toward a black and white dog in the soft snow;A grey dog is jumping toward a black and white dog in the snow;A_entails_B;B_neutral_A;correct: A entails B;;;
7989;The man surrounded by men with a camera is wearing a gray suit and glasses;A man in a suit is being surrounded by photographers;A_entails_B;B_neutral_A;correct: A entails B;;;
7991;The man surrounded by photographers is wearing a gray suit and glasses;A man in a suit is being surrounded by photographers;A_entails_B;B_neutral_A;correct: A entails B;;;
7992;Children in swimming suits are playing in the pool;Children in swimming suits are playing in the water;A_entails_B;B_neutral_A;correct: A entails B;;;
7994;The boys are wearing bathing suits and water is splashing around;The kids are wearing bathing suits and water is splashing around;A_entails_B;B_neutral_A;correct: A entails B;;;
8001;Boys are dangling from straps and kicking at each other;People are dangling from straps and kicking at each other;A_entails_B;B_neutral_A;correct: A entails B;;;
8003;A blonde girl is hanging by gymnastic ropes;A girl is hanging by gymnastic ropes;A_entails_B;B_neutral_A;correct: A entails B;;;
8010;A man dressed in black and white is holding up the tennis racket and is waiting for the ball;A player dressed in black and white is holding up the tennis racket and is waiting for the ball;A_entails_B;B_neutral_A;correct: A entails B;;;
8019;A dog is playing in the green field;A dog is playing on the green grass;A_entails_B;B_neutral_A;correct: A entails B;;;
8023;A brown and white dog is playing on the lawn;A dog is playing on the green grass;A_entails_B;B_neutral_A;correct: A entails B;;;
8027;A brown and white dog is playing on the grass;A dog is playing on the green grass;A_entails_B;B_neutral_A;correct: A entails B;;;
8046;Two men are carrying colorful baskets and blankets and walking near a building;Two people are carrying colorful baskets and blankets and walking near a building;A_entails_B;B_neutral_A;correct: A entails B;;;
8048;Two people are walking with laden baskets and colorful blankets;Two people are walking with laden baskets and blankets;A_entails_B;B_neutral_A;correct: A entails B;;;
8052;Two men are carrying colorful baskets and blankets and walking near a building;Two people are walking with laden baskets and blankets;A_entails_B;B_neutral_A;wrong: A should be neutral to B;colorfull !=> laden;;
8054;Two people are carrying colorful baskets and blankets and walking near a building;Two people are walking with laden baskets and blankets;A_entails_B;B_neutral_A;correct: A entails B;;;
8055;A young girl is sitting in a swimsuit;A young girl is sitting in swimming gear;A_entails_B;B_neutral_A;correct: A entails B;;;
8064;A dog is running on a snowy road;A dog is running on a snowy path;A_entails_B;B_neutral_A;correct: A entails B;;;
8068;A brown dog is running through a snowy path;A dog is running on a snowy path;A_entails_B;B_neutral_A;correct: A entails B;;;
8069;A white dog is running through a snowy trail;A dog is running on a snowy path;A_entails_B;B_neutral_A;correct: A entails B;;;
8072;A brown dog is running through a snowy trail;A dog is running on a snowy path;A_entails_B;B_neutral_A;correct: A entails B;;;
8073;Two boys in white outfits and red protective gear are sparring on a mat;Two children in white outfits and red protective gear are sparring on a mat;A_entails_B;B_neutral_A;correct: A entails B;;;
8075;Two boys are doing martial arts on a blue mat;Two kids are doing martial arts on a blue mat;A_entails_B;B_neutral_A;correct: A entails B;;;
8084;A black and white dog is playing with a broken volleyball;A black and white dog is playing with a broken ball;A_entails_B;B_neutral_A;correct: A entails B;;;
8088;A black and white dog is playing with a ruined volleyball in a brown field;A black and white dog is playing with a broken volleyball;A_entails_B;B_neutral_A;correct: A entails B;;;
8090;A black and white dog is playing with a tattered volleyball in a brown field;A black and white dog is playing with a broken volleyball;A_entails_B;B_neutral_A;correct: A entails B;;;
8102;A topless woman is being smeared with a brown substance and a blurry crowd is in the background;A woman is being smeared with brown substance and a blurry crowd is in the background;A_entails_B;B_neutral_A;correct: A entails B;;;
8109;Two boys and a man are playing games at an arcade;Two kids and a man are playing games at an arcade;A_entails_B;B_neutral_A;correct: A entails B;;;
8118;A female cheerleader is sitting on the knee of a male cheerleader;A female cheerleader is sitting on the knee of a man;A_entails_B;B_neutral_A;correct: A entails B;;;
8120;Some cheerleaders are taking a break;Some cheerleaders are relaxing;A_entails_B;B_neutral_A;correct: A entails B;;;
8129;Several young people are posing for a photo and holding beers;Several young people are posing for a photo and holding drinks;A_entails_B;B_neutral_A;correct: A entails B;;;
8138;The girl has red hair and eyebrows several piercings in a ear and a drawing on the back;The girl has red hair and eyebrows several piercings in a ear and a tattoo on the back;A_entails_B;B_neutral_A;correct: A entails B;;;
8147;The girl in blue is chasing the base runner with a number on the jersey;The girl in blue is chasing the player with a number on the jersey;A_entails_B;B_neutral_A;correct: A entails B;;;
8154;The young man is rock climbing;The man is rock climbing;A_entails_B;B_neutral_A;correct: A entails B;;;
8158;A rocky wall is climbed by a man in a purple hat with bare hands;The young man is rock climbing;A_entails_B;B_neutral_A;correct: A entails B;;;
8160;A man in a purple hat is climbing a rocky wall with bare hands;The man is rock climbing;A_entails_B;B_neutral_A;correct: A entails B;;;
8181;The yellow dog is drinking water from a bottle;The yellow dog is drinking water from a container;A_entails_B;B_neutral_A;correct: A entails B;;;
8201;A woman is looking down and is wearing a wedding dress;A woman is looking down and is wearing a wedding veil;A_entails_B;B_neutral_A;wrong: A should be neutral to B;dress !=> veil;;
8206;A bride with a black veil is looking down;A woman is looking down and is wearing a wedding veil;A_entails_B;B_neutral_A;correct: A entails B;;;
8208;A young girl is standing in a group and is wearing a black shirt and pink beads;A girl is standing in a group and is wearing a black shirt and pink beads;A_entails_B;B_neutral_A;correct: A entails B;;;
8210;A girl has black and orange patches on the cheeks;A girl has colored patches on the cheeks;A_entails_B;B_neutral_A;correct: A entails B;;;
8217;Two large dogs are frolicking in a grassy field;Two large dogs are frolicking in a field;A_entails_B;B_neutral_A;correct: A entails B;;;
8219;Two dogs are running through high grass;Two animals are running through high grass;A_entails_B;B_neutral_A;correct: A entails B;;;
8226;A black dog is running across a rocky landscape;A dog is running across a rocky landscape;A_entails_B;B_neutral_A;correct: A entails B;;;
8228;A black dog is walking along rocky terrain;A black dog is moving along rocky terrain;A_entails_B;B_neutral_A;correct: A entails B;;;
8235;Three small dogs are sniffing at something;Three dogs are sniffing at something;A_entails_B;B_neutral_A;correct: A entails B;;;
8237;Three dogs are resting on a sidewalk;Three dogs are resting on the pavement;A_entails_B;B_neutral_A;correct: A entails B;;;
8246;Some young dirt bikers are getting a dirt bike up a sandy hill;Some young bikers are getting a dirt bike up a sandy hill;A_entails_B;B_neutral_A;correct: A entails B;;;
8255;An older man and a woman are riding bikes on the boardwalk near the ocean;An older man and a woman are riding bikes on the boardwalk near the water;A_entails_B;B_neutral_A;correct: A entails B;;;
8257;An older man and a woman are riding bikes on the boardwalk near the water;A middle aged man and woman are riding bikes down a road beside the water;A_entails_B;B_neutral_A;correct: A entails B;;;
