3907;The man is singing heartily and playing the guitar;A man is playing the guitar;A_entails_B;B_neutral_A;correct: A entails B;singing heartily and playing the guitar=>playing the guitar;;
3909;The man is singing and playing the guitar;The guitar is being played by a man;A_entails_B;B_neutral_A;correct: A entails B;are there not differences between passive and active voice?;;
3911;The man is singing and playing the guitar;A man is playing the guitar;A_entails_B;B_neutral_A;correct: A entails B;singing and playing the guitar=>playing the guitar;;
3914;The women are divinely dancing outside;The women are dancing outside;A_entails_B;B_neutral_A;correct: A entails B;divinely dancing=>dancing;;
3918;The women are dancing outside;A few people are dancing;A_entails_B;B_neutral_A;wrong: A should be neutral to B;the women !=> few people;;
3920;The women are dancing outside;A group of people are dancing;A_entails_B;B_neutral_A;correct: A entails B;The women=>A group of people;;
3936;A boy is attentively looking at a calendar;A boy is looking at a calendar;A_entails_B;B_neutral_A;correct: A entails B;attentively looking=>looking;;
3938;A boy is attentively looking at a calendar;A boy is checking a calendar;A_entails_B;B_neutral_A;correct: A entails B;attentively looking=>checking;;
3945;Two men are fist fighting in a ring;Two people are fist fighting in a ring;A_entails_B;B_neutral_A;correct: A entails B;Two men=>two people;;
3947;The men are fist fighting in a ring;Two people are fist fighting in a ring;A_entails_B;B_neutral_A;correct: A entails B;The men=>two people;;
3951;Two men are fist fighting in a ring;The men are fist fighting in a ring;A_entails_B;B_neutral_A;correct: A entails B;Two men=>the men;;
3957;The boy is riding a bike on the top of a fence made of metal;A biker is riding along the top of a fence;A_entails_B;B_neutral_A;correct: A entails B;boy riding bike=biker, fence made of metal=>fence;;
3960;The boy is riding a bike on the top of a metal fence;The biker is riding along the top of a fence;A_entails_B;B_neutral_A;correct: A entails B;as above, metal fence=>fence;;
3962;The boy is riding a bike on the top of a metal fence;A biker is riding along the top of a fence;A_entails_B;B_neutral_A;correct: A entails B;on the top of a metal fence=>along the top of a fence.;;
3972;A child is slowly waking up;A child is waking up;A_entails_B;B_neutral_A;correct: A entails B;slowly waking up=>waking up;;
3976;A girl is awakening;A child is waking up;A_entails_B;B_neutral_A;correct: A entails B;a girl=>a child and awakening=>waking up;;
3980;A girl is waking up;A child is waking up;A_entails_B;B_neutral_A;correct: A entails B;a girl=>a child;;
3990;A boy is skillfully playing a piano;A boy is playing a piano;A_entails_B;B_neutral_A;correct: A entails B;skillfully playing=>playing;;
3992;A man is singing and playing a guitar;A person is singing and playing a guitar;A_entails_B;B_neutral_A;correct: A entails B;a man => a person;;
4001;A man is recklessly climbing a rope;A man is climbing a rope;A_entails_B;B_neutral_A;correct: A entails B;recklessly climbing=>climbing;;
4008;A man is recklessly climbing a rope;A man is climbing up a rope;A_entails_B;B_neutral_A;correct: A entails B;climbing=> climbing up;;
4012;The woman is picking up a kangaroo that is little;The woman is picking up a baby kangaroo;A_entails_B;B_neutral_A;wrong: A should be neutral to B;a kangaroo that is little=>a baby kangaroo;;
4018;The woman is picking up a baby kangaroo;The lady is picking up the kangaroo;A_entails_B;B_neutral_A;correct: A entails B;woman=>lady baby kangaroo=>kangaroo;;
4021;The woman is picking up a kangaroo that is little;The woman is picking up the kangaroo;A_entails_B;B_neutral_A;correct: A entails B;a kangaroo [that is] little=>the kangaroo;;
4024;The woman is picking up a baby kangaroo;The woman is picking up the kangaroo;A_entails_B;B_neutral_A;correct: A entails B;a baby kangaroo=>the kangaroo;;
4045;A man is dancing;A person is dancing;A_entails_B;B_neutral_A;correct: A entails B;man=>person;;
4047;A man is slowly dancing on the road;A man is dancing on the road;A_entails_B;B_neutral_A;correct: A entails B;slowly dancing on the road=> dancing on the road;;
4049;A man is slowly dancing on the road;A man is dancing;A_entails_B;B_neutral_A;correct: A entails B;slowly dancing on the road=> dancing;;
4051;A man is dancing on the road;A person is dancing;A_entails_B;B_neutral_A;correct: A entails B;dancing on the road=> dancing AND man=>person;;
4053;A man is dancing on the road;A man is dancing;A_entails_B;B_neutral_A;correct: A entails B;dancing on the road=>dancing;;
4054;A dog is running breathlessly on the road;A dog is running on the road;A_entails_B;B_neutral_A;correct: A entails B;running breathlessly=>running;;
4090;Someone is drawing a person;The person is drawing;A_entails_B;B_neutral_A;correct: A entails B;Someone=the person, drawing a person=>drawing;;
4094;A picture is being drawn by a man;The person is drawing;A_entails_B;B_neutral_A;correct: A entails B;active/passive, man=>person;;
4097;A man is drawing a picture;The person is drawing;A_entails_B;B_neutral_A;correct: A entails B;A man=>the person, drawing a picture=>drawing;;
4098;Someone is beautifully playing the piano;Someone is playing a piano;A_entails_B;B_neutral_A;correct: A entails B;beautifully playing=>playing, the piano=>a piano;;
4111;A pizza is being eaten by a man;A man is eating some food;A_entails_B;B_neutral_A;correct: A entails B;active/passive, pizza =>some food;;
4113;A man is eating a pizza;Some food is being eaten by a man;A_entails_B;B_neutral_A;correct: A entails B;active/passive,pizza=>somefood;;
4115;A man is eating a pizza;A man is eating some food;A_entails_B;B_neutral_A;correct: A entails B;a pizza=>some food;;
4136;A man is doing back flips on a trampoline;A man is jumping on a trampoline;A_entails_B;B_neutral_A;correct: A entails B;doing back flips=>jumping;;
4138;Several boys are jumping on a trampoline;Several kids are jumping on a trampoline;A_entails_B;B_neutral_A;correct: A entails B;boys => kids;;
4150;A woman is cutting an onion;A woman is not cutting meat;A_entails_B;B_neutral_A;wrong: A should be neutral to B;a woman is cutting an onion !=> a woman is not cutting meat (different women);;
4152;A woman is cutting meat;There is no woman cutting an onion;A_entails_B;B_neutral_A;wrong: A should be neutral to B;a woman is cutting meat !=> There is no woman cutting an onion (different women);;
4176;An eggplant is being sliced by a woman;A woman is cutting a vegetable;A_entails_B;B_neutral_A;correct: A entails B;active/passive;;
4178;A woman is slicing an eggplant;A woman is slicing a vegetable;A_entails_B;B_neutral_A;correct: A entails B;eggplant=>vegetable, onto;;
4180;A woman is slicing an eggplant;A woman is cutting a vegetable;A_entails_B;B_neutral_A;correct: A entails B;eggplant=>vegetable, slicing=>cutting;;
4181;A dog is eating a doll;A dog is biting a doll;A_entails_B;B_neutral_A;correct: A entails B;eating=>biting;;
4194;A man is praying fervently;A man is praying;A_entails_B;B_neutral_A;correct: A entails B;praying fervently-=> praying;;
4203;A man is cutting a slice of bread;A person is slicing a piece of bread;A_entails_B;B_neutral_A;correct: A entails B;man=>person, cutting=>slicing, slice of bread=>piece of bread;;
4207;A man is slicing bread;A person is slicing a piece of bread;A_entails_B;B_neutral_A;correct: A entails B;bread=>piece of bread;;
4209;A man is slicing some bread;A person is slicing a piece of bread;A_entails_B;B_neutral_A;correct: A entails B;man=>person, some bread=>a piece of bread;;
4212;Someone is scratching the belly of an animal;Someone is stroking the belly of an animal;A_entails_B;B_neutral_A;correct: A entails B;scratching=>stroking;;
4214;Someone is stroking the belly of an animal;A woman is stroking a lemur;A_entails_B;B_neutral_A;wrong: A should be neutral to B;belly of an animal !=> lemur;;
4219;A lemur is eating quickly;A lemur is eating;A_entails_B;B_neutral_A;correct: A entails B;eating quickly=>eating;;
4221;The animal with big eyes is voraciously eating;The animal with big eyes is eating;A_entails_B;B_neutral_A;correct: A entails B;voraciously eating=>eating;;
4225;A lemur is eating quickly;The animal with big eyes is eating;A_entails_B;B_neutral_A;wrong: A should be neutral to B;lemur=>animal with big eyes;;
4230;Two men are talking;Two people are talking;A_entails_B;B_neutral_A;correct: A entails B;two men=>two people;;
4248;A clown is singing and people are dancing;A costumed performer is singing and people are dancing;A_entails_B;B_neutral_A;wrong: A should be neutral to B;clown !=>costumed performer;;
4254;A clown is singing and people are dancing;A song is being sung by a clown;A_entails_B;B_neutral_A;correct: A entails B;active/passive+ A&B=>A;;
4256;A clown is singing and people are dancing;A clown is singing;A_entails_B;B_neutral_A;correct: A entails B;A&B=>A;;
4259;The girl is spraying the plants with water;The girl is watering the plants;A_entails_B;B_neutral_A;correct: A entails B;spraying the plants with water=>watering the plants;;
4272;A man is quickly chopping some mushrooms with a knife;A person is quickly chopping mushrooms with a knife;A_entails_B;B_neutral_A;correct: A entails B;man=>person;;
4275;A man and a woman are shaking hands;Two persons are shaking hands;A_entails_B;B_neutral_A;correct: A entails B;A man and a woman=>two people;;
4279;An woman that is old is shaking hands with a man;A man and a woman are shaking hands;A_entails_B;B_neutral_A;correct: A entails B;old woman=>woman, A shaking hands B=A,b shaking hands;;
4280;A young woman is shaking hands with a man;A man and a woman are shaking hands;A_entails_B;B_neutral_A;correct: A entails B;young woman=>woman;;
4281;An old woman is shaking hands with a man;Two persons are shaking hands;A_entails_B;B_neutral_A;correct: A entails B;old woman=>woman, A shaking hands B=A,b shaking hands;;
4283;An old woman is shaking hands with a man;A man and a woman are shaking hands;A_entails_B;B_neutral_A;correct: A entails B;old woman=>woman, A shaking hands B=A,b shaking hands;;
4288;The woman is slicing cooked octopus;A woman is chopping up an octopus;A_entails_B;B_neutral_A;correct: A entails B;cooked octopus=>octopus, slicing=>chopping;;
4290;The woman is cutting cooked octopus;A woman is cutting an octopus;A_entails_B;B_neutral_A;correct: A entails B;cooked octopus=>octopus, the woman=>a woman;;
4292;The woman is cutting cooked octopus;A woman is chopping up an octopus;A_entails_B;B_neutral_A;correct: A entails B;cutting=>chopping up;;
4302;A man is shooting guns;A man is shooting a weapon;A_entails_B;B_neutral_A;correct: A entails B;guns=>a weapon;;
4304;A woman is riding a horse;A woman is riding an animal;A_entails_B;B_neutral_A;correct: A entails B;a horse=>an animal;;
4320;A man is making a sketch;A man is drawing;A_entails_B;B_neutral_A;correct: A entails B;making a sketch=>drawing;;
4326;The man is painting;A man is drawing;A_entails_B;B_neutral_A;wrong: A should be neutral to B;painting !=>drawing;;
4333;A woman is picking a can;A woman is taking a can;A_entails_B;B_neutral_A;wrong: A should be neutral to B;picking a can !=>taking a can;;
4342;A man is eating a banana;A man is eating a fruit;A_entails_B;B_neutral_A;correct: A entails B;a banana=>a fruit;;
4351;A dog is barking noisily;A dog is barking;A_entails_B;B_neutral_A;correct: A entails B;barking noisily=>barking;;
4353;A jet is flying;A plane is flying;A_entails_B;B_neutral_A;correct: A entails B;jet=>plane;;
4360;A man is cutting a note;A man is cutting a paper;A_entails_B;B_neutral_A;correct: A entails B;a note=>a paper;;
4391;A man is riding a horse in the desert;A man is riding a horse in a sandy land;A_entails_B;B_neutral_A;correct: A entails B;the desert=> a sandy land;;
4393;A man is riding a horse in a sandy land;A guy is riding a horse;A_entails_B;B_neutral_A;correct: A entails B;riding a horse in a sandy land=>riding a horse;;
4394;A man is riding a horse on the beach;A guy is riding a horse;A_entails_B;B_neutral_A;correct: A entails B;riding on the beach=>riding;;
4395;A man is riding a horse in the desert;A horse is being ridden by a guy;A_entails_B;B_neutral_A;correct: A entails B;active/passive+a man is a guy;;
4397;A man is riding a horse in the desert;A guy is riding a horse;A_entails_B;B_neutral_A;correct: A entails B;a man=>a guy;;
4409;Two men in a race are flipping the tires of a tractor;Two people in a race are flipping the tires of a tractor;A_entails_B;B_neutral_A;correct: A entails B;two men=>two people;;
4413;Two people in a race are flipping the tires of a tractor;Two men are racing in a tire rolling competition;A_entails_B;B_neutral_A;wrong: A should be neutral to B;in a race flipping the tires of a tractor !=> racing in a tire rolling competition;;
4427;Some old women are talking;Some women are talking;A_entails_B;B_neutral_A;correct: A entails B;old women=>women;;
4436;A woman is putting on lipstick;A woman is putting on makeup;A_entails_B;B_neutral_A;correct: A entails B;lipstick=> makeup;;
4445;A man is phoning;A man is talking on the phone;A_entails_B;B_neutral_A;wrong: A should be neutral to B;phoning !=> talking on the phone;;
4452;A rhino is grazing in a field;A animal is grazing in a field;A_entails_B;B_neutral_A;correct: A entails B;rhino=>animal;;
4454;The rhino is grazing on the grass;The rhino is being fed on the grass;A_entails_B;B_neutral_A;wrong: A should be neutral to B;grazing on the grass=>being fed on the grass;;
4458;The rhino is grazing on the grass;A animal is grazing in a field;A_entails_B;B_neutral_A;correct: A entails B;grazing on the grass=>grazing in a field;;
4460;A rhino is grazing in a field;The rhino is grazing on the grass;A_entails_B;B_neutral_A;correct: A entails B;in a field=>on the grass;;
4461;A couple is running towards the ocean;A couple is running towards the water;A_entails_B;B_neutral_A;correct: A entails B;ocean=>water;;
4463;A man and a woman are running together and holding hands;A couple is running and holding hands;A_entails_B;B_neutral_A;correct: A entails B;running together=>running;;
4469;A man and a woman are running together and holding hands;A couple is running towards the ocean;A_entails_B;B_neutral_A;wrong: A should be neutral to B;running together !=>towards the ocean;;
4470;A man is kicking a soccer ball;A man is kicking a ball;A_entails_B;B_neutral_A;correct: A entails B;soccer ball=>ball;;
4479;The boy is playing the piano;The boy is playing a musical instrument;A_entails_B;B_neutral_A;correct: A entails B;the piano=>a musical instrument;;
4490;A girl is brushing her hair;A girl is styling her hair;A_entails_B;B_neutral_A;correct: A entails B;brushing her hair=>styling her hair;;
4494;A girl is combing her hair;A girl is styling her hair;A_entails_B;B_neutral_A;correct: A entails B;combing her hair=>styling her hair;;
4497;The doctors are healing a man;The doctors are reviving a man;A_entails_B;B_neutral_A;wrong: A should be neutral to B;healing a man=>reviving a man;;
4505;The doctors are healing a man;The doctor is helping the patient;A_entails_B;B_neutral_A;correct: A entails B;The doctors are healing a man=>helping the patient;;
4507;The doctors are reviving a man;The doctor is helping the patient;A_entails_B;B_neutral_A;correct: A entails B;reviving a man=>helping the patient;;
4528;A man is riding a horse;A man is riding an animal;A_entails_B;B_neutral_A;correct: A entails B;horse=>animal;;
4535;A cat is crawling under a piece of furniture;An animal is crawling under a piece of furniture;A_entails_B;B_neutral_A;correct: A entails B;cat=>animal;;
4541;A cat is sliding upside down under a couch;An animal is crawling under a piece of furniture;A_entails_B;B_neutral_A;wrong: A should be neutral to B;sliding upside down under a couch=>crawling under a piece of furniture;;
4566;Two men are battling;Some men are fighting;A_entails_B;B_neutral_A;correct: A entails B;battling=>fighting, two men=>some men;;
4568;A group of men is fighting;Two men are fighting;A_entails_B;B_neutral_A;correct: A entails B;A group of men=>two men;;
4570;Two men are fighting;Some men are fighting;A_entails_B;B_neutral_A;correct: A entails B;Two men=>some men;;
4571;A couple of policewomen are singing karaoke;A couple of policewomen are singing;A_entails_B;B_neutral_A;correct: A entails B;singing karaoke=>singing;;
4573;Two women are happily dancing;Two women are dancing;A_entails_B;B_neutral_A;correct: A entails B;happily dancing=>dancing;;
4582;A woman is riding a horse;An animal is being ridden by a woman;A_entails_B;B_neutral_A;correct: A entails B;active/passive horse=>animal;;
4589;A hamster is singing;A small animal is singing;A_entails_B;B_neutral_A;lack of common-sense;hamster=>small animal,;;
4602;A man is performing with a guitar;A man is playing a guitar;A_entails_B;B_neutral_A;correct: A entails B;performing with a guitar=>playing a guitar;;
4604;A man is singing and playing a guitar;A guitar is being played by a man;A_entails_B;B_neutral_A;correct: A entails B;active/passive;;
4606;A man is singing and playing a guitar;A man is playing a guitar;A_entails_B;B_neutral_A;correct: A entails B;A&B=>B;;
4611;A man is driving a car;A man is driving a vehicle;A_entails_B;B_neutral_A;correct: A entails B;car=>vehicle;;
4616;A boy is cutting grass with scissors;A kid is cutting grass with scissors;A_entails_B;B_neutral_A;correct: A entails B;boy=>kid;;
4620;The boy is shortening the grass by the curb with scissors;A boy is cutting grass with scissors;A_entails_B;B_neutral_A;correct: A entails B;shortening the grass=>cutting the grass;;
4622;The boy is cutting the grass by the curb with scissors;A kid is cutting grass with scissors;A_entails_B;B_neutral_A;correct: A entails B;grass by the curb=>grass;;
4624;The boy is cutting the grass by the curb with scissors;A boy is cutting grass with scissors;A_entails_B;B_neutral_A;correct: A entails B;grass by the curb=>grass;;
4647;A man is cutting a big rope with a sword;A man is cutting a rope with a sword;A_entails_B;B_neutral_A;correct: A entails B;big rope=>rope;;
4649;A man is cutting a thick rope with a sword;A man is cutting a cord with a sword;A_entails_B;B_neutral_A;correct: A entails B;thick rope=>cord;;
4651;A man is cutting a thick rope with a sword;A man is cutting a rope with a sword;A_entails_B;B_neutral_A;correct: A entails B;thick rope=>rope;;
4673;Someone is drilling a hole in a strip of wood with a power drill;Someone is making a hole in a strip of wood with a drill;A_entails_B;B_neutral_A;correct: A entails B;drilling a hole=>making a hole;;
4675;A man is drilling a hole in a piece of wood;Someone is making a hole in a strip of wood with a drill;A_entails_B;B_neutral_A;correct: A entails B;drilling a hole=>making a hole, with a drill;;
4680;Someone is drilling a hole in a strip of wood with a power drill;A man is drilling a hole in a piece of wood;A_entails_B;B_neutral_A;correct: A entails B;drilling a hole=>making a hole;;
4696;A man is showing off a small monkey;A man is holding an animal which is small in one hand;A_entails_B;B_neutral_A;wrong: A should be neutral to B;showing off a small monkey !=>holding small animal in hand;;
4699;A group of boys is playing soccer on the seashore;A group of boys is playing soccer on the beach;A_entails_B;B_neutral_A;correct: A entails B;seashore=>beach;;
4701;A group of men is playing soccer on the beach;A group of men is playing with a ball on the beach;A_entails_B;B_neutral_A;correct: A entails B;playing soccer =>playing with a ball;;
4708;A man is cutting pieces of butter into a mixing bowl;A man is adding pieces of butter to a mixing bowl;A_entails_B;B_neutral_A;correct: A entails B;cutting pieces of butter into a mixing bowl=>adding;;
4716;A man is cutting pieces of butter into a mixing bowl;Pieces of butter are being added to the stand mixer;A_entails_B;B_neutral_A;wrong: A should be neutral to B;mixing bowl !=> stand mixer;;
4732;A man is fixing a silencer to a gun;A man is fitting a silencer to a weapon;A_entails_B;B_neutral_A;correct: A entails B;fixing=>fitting, gun=>weapon;;
4736;A man is fitting a silencer to a pistol;A man is fixing a silencer to a gun;A_entails_B;B_neutral_A;correct: A entails B;fitting=>fixing (silencer), pistol=>gun;;
4737;A man on a motorcycle is riding on one wheel;A man on a motorcycle is doing a trick;A_entails_B;B_neutral_A;correct: A entails B;riding on one wheel=>doing a trick;;
4739;A person is performing acrobatics on a motorcycle;A person is performing tricks on a motorcycle;A_entails_B;B_neutral_A;correct: A entails B;acrobatics on a motorcycle=>tricks on a motorcycle;;
4742;A man on a motorcycle is riding on one wheel;A person is performing acrobatics on a motorcycle;A_entails_B;B_neutral_A;correct: A entails B;riding on one wheel=>performing acrobatics;;
4745;A man on a motorcycle is doing a trick;A person is performing tricks on a motorcycle;A_entails_B;B_neutral_A;correct: A entails B;doing a trick=>performing tricks;;
4747;A man on a motorcycle is riding on one wheel;A person is performing tricks on a motorcycle;A_entails_B;B_neutral_A;correct: A entails B;riding on one wheel=>doing a trick;;
4757;A man is dancing in the rain;A person is dancing in the rain;A_entails_B;B_neutral_A;correct: A entails B;man=>person;;
4759;A man is singing into an old microphone;A man is singing into a microphone;A_entails_B;B_neutral_A;correct: A entails B;old microphone=>microphone;;
4768;The man is dropping sliced cucumbers into cold water;The man is dropping sliced cucumbers into water;A_entails_B;B_neutral_A;correct: A entails B;cold water=>water;;
4779;A young boy is playing a guitar;A boy is playing guitar;A_entails_B;B_neutral_A;correct: A entails B;young boy=>boy, playing a guitar=>playing guitar;;
4781;A little boy is playing a guitar;A guitar is being played by a boy;A_entails_B;B_neutral_A;correct: A entails B;active/passive;;
4783;A little boy is playing a guitar;A boy is playing guitar;A_entails_B;B_neutral_A;correct: A entails B;little boy=>boy, playing a guitar=>playing guitar;;
4793;A boy is playing a guitar;A boy is playing an instrument;A_entails_B;B_neutral_A;correct: A entails B;a guitar=>an instrument;;
4797;A boy is playing a guitar;A guitar is being played by a kid;A_entails_B;B_neutral_A;correct: A entails B;active passive, boy=>kid;;
4801;A boy is playing a guitar;A kid is playing guitar;A_entails_B;B_neutral_A;correct: A entails B;boy=>kid;;
4828;A man is cutting a potato into pieces;A man is cutting a potato;A_entails_B;B_neutral_A;correct: A entails B;cutting x into pieces=>cutting x;;
4832;A man is slicing a potato into pieces;A man is cutting a potato;A_entails_B;B_neutral_A;correct: A entails B;slicing into pieces=>cutting;;
4862;A woman is exercising;A person is exercising;A_entails_B;B_neutral_A;correct: A entails B;woman=>person;;
4880;A person is stirring vegetables in a pot;A person is stirring vegetables in a bowl;A_entails_B;B_neutral_A;wrong: A should be neutral to B;pot=>bowl;;
4884;Vegetables are being mixed in a pot by a man;A person is stirring vegetables in a pot;A_entails_B;B_neutral_A;correct: A entails B;active/passive, mixing=>stirring;;
4886;A man is mixing vegetables in a pot;A person is stirring vegetables in a pot;A_entails_B;B_neutral_A;correct: A entails B;mixing=>stirring;;
4887;A man is doing pull-ups;A man is doing exercises;A_entails_B;B_neutral_A;correct: A entails B;pull-ups=>exercises;;
4889;The man is doing exercises in a gym;The man is exercising;A_entails_B;B_neutral_A;correct: A entails B;doing exercises in a gym=>exerising;;
4895;A man is doing pull-ups;The man is exercising;A_entails_B;B_neutral_A;correct: A entails B;doing pull-ups=>exercising;;
4898;A man is sharpening a knife;A man is sharpening a weapon;A_entails_B;B_neutral_A;correct: A entails B;the parquet=>hardwood floor;;
4907;A cat is walking on the parquet;A cat is walking on a hardwood floor;A_entails_B;B_neutral_A;correct: A entails B;the parquet=>hardwood floor;;
4916;A man is singing and playing a guitar;A man is singing and playing a musical instrument;A_entails_B;B_neutral_A;correct: A entails B;a guitar=>a musical instrument;;
4925;Someone is putting ingredients into a wok;Someone is putting ingredients into a pan;A_entails_B;B_neutral_A;correct: A entails B;a wok=>a pan;;
4941;The military officer is barking at the recruits;An officer is talking to the soldiers;A_entails_B;B_neutral_A;correct: A entails B;barking at the recruits=>talking to soldiers;;
4944;The military officer is barking at the recruits;An officer is talking to the recruits;A_entails_B;B_neutral_A;correct: A entails B;jeep is pulling up=>jeep stopping;;
4954;A child is walking down the street and a jeep is pulling up;A child is walking down the street and a jeep is stopping;A_entails_B;B_neutral_A;correct: A entails B;jeep is pulling up=>jeep stopping;;
4956;A man in a car is pulling up beside a woman who is walking along the street;A man in a car is pulling up beside a woman that is who along a road;A_entails_B;B_neutral_A;correct: A entails B;B is ungrammatical: A man in a car is pulling up beside a woman that is who along a road.;A man in a car is pulling up beside a woman who is along a road;
4972;An onion is being chopped;An onion is being sliced;A_entails_B;B_neutral_A;correct: A entails B;chopped=>sliced;;
4974;Someone is holding a hedgehog;Someone is holding a small animal;A_entails_B;B_neutral_A;correct: A entails B;a hedgehog=>a small animal;;
5001;A cat is opening a drawer and jumping inside;A cat is opening a drawer and climbing inside;A_entails_B;B_neutral_A;correct: A entails B;jumping inside(a drawer)=>climbing inside;;
