pair_ID,sentence_A,sentence_B,entailment_label,relatedness_score,entailment_AB,entailment_BA,sentence_A_original,sentence_B_original,sentence_A_dataset,sentence_B_dataset,SemEval_set
977,A man is falling off a horse on a track and is laid in the wild,A man is getting on a horse on a track laid in the wild,ENTAILMENT,3.8,A_entails_B,B_contradicts_A,A man falls off his horse on a racetrack.,A man falls off his horse on a racetrack.,FLICKR,FLICKR,TEST
2445,The man is playing the piano with his nose,A man is playing the keyboard with his nose,ENTAILMENT,4.5,A_entails_B,B_contradicts_A,a man plays the keyboard with his nose,the man is playing the piano with his nose,SEMEVAL,SEMEVAL,TRAIN
5480,The lady is cracking an egg into a bowl,The lady is cracking an egg into a dish,ENTAILMENT,4.5,A_entails_B,B_contradicts_A,the lady cracked an egg into a bowl,the lady cracked an egg into a bowl,SEMEVAL,SEMEVAL,TRAIN
5555,The man is aiming a gun,The man is drawing a gun,ENTAILMENT,4.2,A_entails_B,B_contradicts_A,the man is aiming a gun,the man is aiming a gun,SEMEVAL,SEMEVAL,TRAIN
5731,A cow is eating grass,A cow is eating hay,ENTAILMENT,4.2,A_entails_B,B_contradicts_A,a cow is eating grass,a cow is eating hay,SEMEVAL,SEMEVAL,TEST
6819,There is no man on a bicycle riding on the beach,A person is riding a bicycle in the sand beside the ocean,ENTAILMENT,3.9,A_entails_B,B_contradicts_A,a person rides his bicycle in the sand beside the ocean,a man on a bicycle riding on the beach,FLICKR,FLICKR,TRAIN
7775,No surfer is riding a big wave across dark green water,The surfer is riding a big wave,ENTAILMENT,4,A_entails_B,B_contradicts_A,a surfer rides a big wave across dark green water,the surfer is coming in from riding a big wave,FLICKR,FLICKR,TEST
8571,A large dog and a small dog are standing next to the kitchen counter and are investigating,A large dog and a small dog is standing on the kitchen counter and investigate,ENTAILMENT,4.4,A_entails_B,B_contradicts_A,a large dog and a small dog stand next to the kitchen counter to investigate,a large dog and a small dog stand next to the kitchen counter to investigate,FLICKR,FLICKR,TRAIN
